上海市,上海,城市车保美容会所,19121315515,闵行区畹町路399号,08:30-21:00
上海市,上海,嘉实多（上海鑫静汽车服务有限公司）,18930557890,闵行区山花路86号,08:00-19:00
上海市,上海,宝帅钣喷汽车维修中心,17317323736,闵行区澄江路1276号,09:00-18:00
上海市,上海,禾田晟汽车生活馆,13386166399,青浦区新府中路1528弄6号,07:50-18:30
上海市,上海,邓禄普（上海鸿运汽车美容）,17521259334,青浦区纪鹤公路3287号,06:00-22:00
上海市,上海,上海安意汽车修理服务有限公司,13918975885,奉贤区川南奉公路9289号,09:00-18:00
上海市,上海,美车汇汽车维修美容中心,18001936566,闵行区七莘路3333弄6区19号,09:00-18:00
上海市,上海,实田车饰,02164069815,闵行区虹梅南路2638弄29号,09:00-18:00
上海市,上海,车驹汇汽车维修服务,18917984006,闵行区沪星路318号,09:00-18:00
上海市,上海,上海卉坤汽车配件销售中心,13764732632,青浦区华志路16号,09:00-18:00
上海市,上海,车车翔（奉贤店）,02157520528,奉贤区新奉公路4837号,08:00-18:00
上海市,上海,东晨汽车维修服务,17702102681,闵行区吴中路2768号,08:00-22:00
上海市,上海,德国马牌（闽车坊汽车用品店）,13661720668,闵行区吴中路2711号,09:00-18:00
上海市,上海,汉玛汽车服务中心,13816442845,青浦区新益路467号,06:00-22:00
上海市,上海,安齐汽车维修中心,13564130419,嘉定区曹安公路5490号,09:00-18:00
上海市,上海,上海驰修汽服（漕宝路店）,18751858830,闵行区漕宝路3299号（宝龙城新龙路西区入口 B1A区）,09:00-18:00
上海市,上海,优悦汽车维修,13916439632,嘉定区安亭镇曹安公路5516号,09:00-18:00
上海市,上海,马石油(上海泉旺汽服),13621840810,青浦区纪鹤路2289号,08:30-20:04
上海市,上海,嘉实多（上海罡晨佳亿汽车）,18049856482,青浦区华富街69-75号,09:00-18:00
上海市,上海,嘉实多（上海罡胜汽车服务有限公司）,13918379937,青浦区华新镇华富街69-75号,09:00-18:00
上海市,上海,邓禄普（旌骋汽车服务）,18917978368,青浦区华新镇华新街45号,09:00-18:00
上海市,上海,固特异（乐意汽车服务）,15821346978,闵行区七宝镇航南路546－548号,08:00-20:00
上海市,上海,澳造型汽车服务（闵建店）,15901743883,闵行区龙吴路3449号-双柏路口-加油站内,09:00-18:00
上海市,上海,卓泰汽车装潢养护中心,15000746244,浦东新区航南公路1018号,07:30-18:00
上海市,上海,腾飞汽车养护（华纪路店）,15502117009,青浦区 华新镇华纪路106号,07:00-19:30
上海市,上海,车霸汽车专业维修,15000329500,嘉定区安亭镇民丰路908号,07:00-19:00
上海市,上海,金吉星（巧洁汽车服务有限公司）,13636498760,闵行区浦江镇江园路872-874号,09:00-18:00
上海市,上海,德国马牌（上海羲杰服务有限公司）,13020160168,嘉定区昌吉路151弄21号,09:00-16:00
上海市,上海,德国马牌（昌吉路店）,02159570808,嘉定区安亭镇昌吉路156弄21号,09:00-17:33
上海市,上海,Umbrella汽车生活馆,18930076376,闵行区同乐路158号A座,09:00-18:00
上海市,上海,嘉实多（宝鑫汽车养护中心）,13761134525,嘉定区和静路988-2号,08:00-20:00
上海市,上海,柚紫养车（虹梅南路店）,02134127925,闵行区虹梅南路1009号,09:00-18:00
上海市,上海,德国力魔（上海宁悦汽车服务有限公司）,13661503397,嘉定区民丰路568号（9-13号）,08:00-19:00
上海市,上海,靓车堂汽车一站式服务,18964596644,嘉定区绿苑路380弄-1号,08:00-20:00
上海市,上海,马石油（上海鑫宇汽车服务中心）,15802122061,嘉定区绿苑路380弄1号,06:46-22:00
上海市,上海,倍耐力（雅歌汽车服务）,13321815810,闵行区漕宝路1555号(大上海国际花园内),07:30-19:00
上海市,上海,1车1库（工场店）,18501745433,闵行区兴达路228号,08:30-17:30
上海市,上海,友单汽修,13918319319,嘉定区安亭镇黄渡新黄路8号,09:00-18:00
上海市,上海,欧洲维修（凌度汽车）,15000680980,闵行区三达路85号103室,08:00-17:30
上海市,上海,道达尔（天辰汽车服务),13641664973,嘉定区曹安公路4589号,09:00-18:00
上海市,上海,鑫盛汽车一站式服务,18917059151,闵行区昌林路168号,08:00-20:00
上海市,上海,联胜汽车服务,18717806458,闵行区浦江镇浦连路278号,08:00-19:30
上海市,上海,德国马牌（安华君车行）,13402066863,徐汇区丹棱路68号,09:00-18:00
上海市,上海,ALL THE WAY汽车服务中心,18565250436,徐汇区上中西路135弄6号,08:30-18:30
上海市,上海,固特异（博阶爱车）,13585506892,浦东新区航头镇航鹤路139弄88号,08:00-20:00
上海市,上海,君达汽车服务中心（叶家桥路店）,13816881108,闵行区浦江镇叶家桥路173号,09:00-18:00
上海市,上海,上海驭名汽车销售服务有限公司,13636501951,闵行区华漕镇北翟路3386弄69号105-106栋,08:30-18:00
上海市,上海,喜车汇,18016297670,浦东新区航头路1677号,07:30-20:30
上海市,上海,嘉实多（上海炫艺）,18516652948,闵行区黄桦路456-458号,09:00-18:00
上海市,上海,傅林汽车服务,15921091450,闵行区北江榉路688弄3号楼129号,08:00-17:30
上海市,上海,美驰汽车服务（徐汇店）,15900807172,徐汇区嘉川路89号,09:00-18:00
上海市,上海,新达汽车装潢用品,18800390272,闵行区浦江镇江月路1500号3区309-313,09:00-18:00
上海市,上海,车车翔（吴中路店）,02164052089,闵行区吴中路1179号,08:00-18:00
上海市,上海,车车翔（航头店）,13331852575,浦东新区航头镇航头路1315号,07:00-20:00
上海市,上海,鹏飞汽车维修配件中心,13916958673,徐汇区罗成路993-995号,08:00-18:00
上海市,上海,柚紫养车（沪南公路店）,02168220625,浦东新区航头镇沪南公路5495号,09:00-18:00
上海市,上海,邓禄普（ 上海厚万汽车服务中心）,13818358058,嘉定区爱特路167号,09:00-18:00
上海市,上海,车杰汽车维修连锁(爱特路店),18717887167,嘉定区江桥镇爱特路157号,09:00-18:00
上海市,上海,胖子汽车修理美容俱乐部,13816164885,徐汇区龙川北路729号,08:00-20:00
上海市,上海,嘉实多（鹏余汽车服务）,13472632008,嘉定区金园一路1615号,09:00-18:00
上海市,上海,上海永畅汽车服务有限公司,13482496135,嘉定区星华公路621号,09:00-18:00
上海市,上海,大拇指专业汽修养护中心,18302172767,浦东新区航圆路1003号,07:30-19:00
上海市,上海,新速汽车服务,15221855741,徐汇区钦州北路925号,09:00-18:00
上海市,上海,元征汽车快修服务,13701677627,徐汇区龙吴路899号,07:00-19:00
上海市,上海,嘉实多（上海飒丰汽车技术服务）,13818667123,徐汇区桂林路750号,08:30-18:30
上海市,上海,嘉实多（坤迪汽修）,18621098106,嘉定区金园一路963号,08:30-19:00
上海市,上海,美孚（上海临新汽车快修有限公司）,18918395270,浦东新区彩云路729号,09:00-18:00
上海市,上海,挚友汽车综合服务部,13816979278,徐汇区三江路12号,08:00-19:30
上海市,上海,壳牌（项溢汽车服务）,18217209698,嘉定区倪家桥路48号,09:00-18:00
上海市,上海,城市车保(星空店),13716391230,长宁区虹桥路1665号(星空广场七楼停车场),09:00-20:30
上海市,上海,泽星汽车服务,17521506009,嘉定区曹安公路3333号,08:00-20:00
上海市,上海,儒安汽车维修有限公司,13585993232,嘉定区金园五路321号,08:30-18:30
上海市,上海,上海驰修汽服（新环西路店）,18916216245,浦东新区新场镇新环西路771号,09:00-18:00
上海市,上海,车车翔（和融路店）,13523132170,浦东新区和融路176号,09:00-18:00
上海市,上海,倍耐力(颂腾汽车服务有限公司),13386020806,长宁区新渔东路701号,08:00-18:00
上海市,上海,云飞汽车服务中心,13512142647,嘉定区管新路668号,06:00-22:00
上海市,上海,车卫士汽车维修养护中心,15121121812,嘉定区广由新村650弄,09:00-18:00
上海市,上海,嘉实多（云峰卡尔来弗汽车养护连锁）,18367372625,徐汇区龙水南路60号,06:30-20:00
上海市,上海,德国马牌（上海驰家汽车封浜店）,18917866695,嘉定区翔黄公路1090号,06:00-18:00
上海市,上海,华昊汽车服务站,13764347500,嘉定区吴杨东路413号,09:00-18:00
上海市,上海,俊安汽车养护中心,15502111121,嘉定区封浜镇翔黄公路1118号,09:00-18:00
上海市,上海,倍耐力（车岛汽车生活馆）,15026868517,浦东新区沪南公路7377号,07:33-20:44
上海市,上海,普利司通（阿建汽车）,13636323281,普陀区香樟路128号,08:00-19:00
上海市,上海,壳牌（ 乐诚汽车服务）,15216802143,嘉定区华江路356号,08:30-22:01
上海市,上海,玛吉斯（车美洁汽车服务中心）,13122004119,浦东新区长清路2059号,07:00-19:00
上海市,上海,车车翔（灵岩南路店）,18621676637,浦东新区灵岩南路1519号,09:00-18:00
上海市,上海,柚紫养车（秋雨路店）,02158080871,浦东新区秋雨路585弄10号,09:00-18:00
上海市,上海,车联万家（华江路店）,13564672944,嘉定区华江路220号,09:00-18:00
上海市,上海,友鑫汽修服务中心,18721578552,嘉定区嘉松北路430号,09:00-18:00
上海市,上海,上海驰顷汽车服务,13641825523,嘉定区嘉松北路346号冈峰新苑旁边,07:00-23:00
上海市,上海,宽途汽车（佰晟汽车服务有限公司）,13701758235,嘉定区金沙江路3168-2号,08:00-17:00
上海市,上海,壳牌（上海慧翔汽车美容）,15300588206,嘉定区胜辛南路855号,08:00-19:00
上海市,上海,金富力（芸尧汽修）,15000915022,闵行区立跃路777号院内修车,08:00-21:00
上海市,上海,小王汽车机修美容,15001918969,浦东新区泥城镇人民村高桥210号,07:30-19:00
上海市,上海,统一（九梓汽车服务有限公司）,13564268819,嘉定区翔黄公路321号,09:00-18:00
上海市,上海,韩泰轮胎(鑫骊德汽车),13818539242,普陀区花家浜路422号,07:00-20:00
上海市,上海,邓禄普（二龙汽车轮胎销售中心）,13818193395,嘉定区海蓝路155号,09:00-18:00
上海市,上海,小拇指（晓峰汽修）,15202118460,浦东新区泥城镇大泥公路3588号,08:00-17:00
上海市,上海,邓禄普（驿星汽车服务有限公司）,17621476471,嘉定区曹安路2300弄91号,08:00-21:30
上海市,上海,嘉实多（上海杨林汽车服务站）,15618666162,浦东新区灵岩南路357号,08:00-21:00
上海市,上海,新东海汽车服务,13120882380,嘉定区沪宜公路653号,06:00-18:00
上海市,上海,壳牌（上海翔峰汽车服务有限公司）,18917058029,嘉定区沪宜公路827号,08:00-18:30
上海市,上海,龙美汽车美容洗车,13761621517,嘉定区曹安公路2098号135室,06:00-18:00
上海市,上海,驰家汽车养护,13524857455,嘉定区双单路1509弄龙湖郦城西区地下车库259幢615-620,06:00-18:00
上海市,上海,安耐特(CF汽车养护中心),15000890842,嘉定区胜辛南路1859号,08:00-20:00
上海市,上海,壳牌（新东海一站式汽车服务）,13671570407,嘉定区惠亚路118弄18号,09:00-18:00
上海市,上海,翔升汽车美容养护中心,15207275566,浦东新区周浦镇沈梅东路275号哈里邻3号地下停车场,08:19-21:30
上海市,上海,车知音汽车装潢美容护理中心,18217769687,嘉定区宝安公路3799号24栋14号,07:30-21:00
上海市,上海,勇享车（斜土路店）,13381668567,徐汇区斜土路1995号（家乐福地下停车库）,09:00-19:00
上海市,上海,美孚（赫福汽车维修服务有限公司·）,13166460778,嘉定区南翔镇沪宜公路325号,08:00-18:00
上海市,上海,固特异（上海汨晨汽车）,13818352379,嘉定区铜川路2687号,09:00-18:00
上海市,上海,邓禄普（上海车致汽车服务连锁）,17301632065,浦东新区沪南公路3468弄2支弄27号,08:00-22:00
上海市,上海,焱娜汽车服务,13162333331,嘉定区金鼎路2436号,09:00-18:00
上海市,上海,璨华汽修（海阳路店）,17521286320,浦东新区三林镇海阳路1165号,08:00-22:00
上海市,上海,靓琦快修装潢,15000646283,嘉定区合作路688号,08:00-18:00
上海市,上海,嘉实多（新荣创汽车维修服务）,17317736263,嘉定区云屏路1660号,08:00-18:00
上海市,上海,欧洲维修（福驰汽修）,13661655507,浦东新区尚博路749-753号,09:00-18:00
上海市,上海,京车会（上海翊兴汽车服务有限公司）,13636511162,浦东新区沪南公路3196号,08:30-19:00
上海市,上海,嘉实多(上海挑米汽车服务),18917561653,普陀区金通路1360号,08:00-17:00
上海市,上海,嘉实多（上海德卫汽车技术服务有限公司）,13761095381,浦东新区德州路88号（近洪山路）,08:30-18:00
上海市,上海,柚紫养车（洪德路店）,02159118029,嘉定区洪德路1159号,09:00-18:00
上海市,上海,邓禄普（鑫檀汽车技术有限公司）,17302135609,浦东新区宣桥镇汇成路1777号,09:00-18:00
上海市,上海,美孚（上海闽坤汽车服务有限公司）,18939941852,浦东新区云台路553-555号,09:00-18:00
上海市,上海,嘉实多（新荣创汽车服务连锁）,18616954435,嘉定区马陆镇马陆村育英街531号,08:00-19:00
上海市,上海,倍耐力（唯美汽车经营装潢部）,15900454705,浦东新区宣桥镇宣黄公路153号,06:30-19:00
上海市,上海,帝品汽车美容店,13524713862,浦东新区宣黄公路360号,07:30-19:00
上海市,上海,勇享车（打浦桥店）,15821639313,黄浦区打浦路660号（绿地缤纷城地下停车库b2）,09:00-19:00
上海市,上海,上海盟匠汽车服务有限公司,13301835290,浦东新区新瀚路20号,08:00-18:00
上海市,上海,嘉实多（巧之匠汽车维修服务）,13301753751,浦东新区申江南路4888号4幢105号,08:00-18:00
上海市,上海,邓禄普（上海尚名汽车服务有限公司）,13636443317,浦东新区沪南路8749号,08:00-18:00
上海市,上海,玛吉斯(驰家汽车),15601605313,普陀区白丽路676号,06:00-18:00
上海市,上海,勇享车（齐河路店）,15021243393,浦东新区齐河路258号（沃尔玛超市四楼停车场）,09:00-18:00
上海市,上海,靓车坊（飞德勒轮胎）,18217688123,黄浦区中山南一路802号,08:00-19:00
上海市,上海,申世汽车,15692197262,浦东新区周东路681号,08:00-18:00
上海市,上海,1车1库（川周公路店）,15900712950,浦东新区川周公路4175号,09:00-18:00
上海市,上海,壳牌（烁金汽车服务）,13918215418,嘉定区沪宜公路2488号,08:00-19:30
上海市,上海,壳牌（快洁汽车服务有限公司）,02150776007,浦东新区浦三路1515号,07:30-18:40
上海市,上海,壳牌喜力（上海佳佩汽车服务有限公司）,18221121145,嘉定区福海路726号,08:00-18:00
上海市,上海,上海宇诺汽车修理厂,13916604997,普陀区真陈路155号,07:00-20:00
上海市,上海,上海涛宝汽车服务有限公司,13916326748,普陀区真陈路39号乙,08:30-17:30
上海市,上海,美孚（上海腾宇汽车维修服务）,13918809682,浦东新区东书房路80号,08:00-18:00
上海市,上海,万力（小王汽车装潢服务中心）,13818897145,嘉定区马陆嘉新公路1370号,06:00-18:00
上海市,上海,金宇（小王美容装潢快修服务中心）,18701828246,嘉定区嘉定公路1278号,09:00-18:00
上海市,上海,迈德先生,18049733597,浦东新区高科西路988号,09:00-18:00
上海市,上海,法路（博斯卡汽车服务）,13162742279,浦东新区环湖西三路63号105室,08:00-18:00
上海市,上海,钢钢汽车服务站,13818084398,浦东新区杨莲路锦绣路3891号,09:00-18:00
上海市,上海,车博士汽车养护中心,18721255450,浦东新区浦东新区茂盛路138号,09:00-18:00
上海市,上海,智捷汽车养护中心,17321090602,嘉定区彭封路138号,09:00-18:00
上海市,上海,车车翔（康桥路店）,18017839941,浦东新区康桥路1200号（近御青路）,07:00-20:00
上海市,上海,凯实通汽车精护中心（嘉定店）,17321358330,嘉定区沪宜公路3213号,08:00-18:00
上海市,上海,固特异（好迪雅汽车服务中心）,18321860758,浦东新区临沂路180号,08:00-18:00
上海市,上海,上海驰修汽服（北蔡宜家店）,18930705789,浦东新区临御路550号B1停车场内E3区,10:00-20:00
上海市,上海,豫捷汽修美容中心,15902193427,嘉定区彭封路108号,08:00-19:00
上海市,上海,上海骋州汽车服务有限公司,02158000090,浦东新区惠南镇听潮南路321弄1号,08:00-19:00
上海市,上海,车车翔（城银路店）,18616954577,宝山区城银路700号,09:00-18:00
上海市,上海,上海摩旋汽车服务有限公司,13916334356,浦东新区御衡路118-120号,09:00-18:00
上海市,上海,上海住睿汽车租赁有限公司,18818111893,黄浦区柳市路99号,07:00-22:00
上海市,上海,车车翔（临沂路店）,15618505055,浦东新区临沂路47号,08:00-18:00
上海市,上海,义程汽车服务,13524734921,浦东新区御衡路230号,09:00-18:00
上海市,上海,上海好达雅汽车技术服务有限公司,18701976058,浦东新区临沂路47-51号,08:00-20:00
上海市,上海,卓越汽车服务中心（御衡店）,13472892500,浦东新区御衡路56号,09:00-18:00
上海市,上海,勇享车(城中路店),15026799075,嘉定区城中路138号（罗宾森购物广场B2),09:00-21:00
上海市,上海,靓车洁汽车美容连锁机构,13801932026,浦东新区惠南镇沪南公路9851号,08:30-17:30
上海市,上海,润达汽修,15221895960,嘉定区浏翔公路2001号,09:00-18:00
上海市,上海,花生养车（惠南店）,15317216841,浦东新区听悦路345号,08:00-19:00
上海市,上海,A+便民洗车工作室（北蔡51生活广场店）,18221823721,浦东新区北中路160号（地下停车场负二层）,09:00-19:00
上海市,上海,朗越汽车美容装潢,15921314873,浦东新区塘桥路320号,09:00-18:00
上海市,上海,车车翔(城南路店),18101803110,浦东新区惠南镇城南路230号,08:00-17:00
上海市,上海,韩泰（荣爵汽车用品）,18321803267,浦东新区广衍路16号,07:30-18:00
上海市,上海,美孚（阿贵汽车维修）,18601759392,浦东新区宣桥镇亦园路74弄42号,07:00-19:00
上海市,上海,爱车邦,18221373966,浦东新区东绣路999弄9号（近东建路）,09:00-18:00
上海市,上海,德国福斯（驰洪汽车服务）,15221403009,嘉定区澄浏中路2483号,08:00-19:00
上海市,上海,勇享车（杨高南路店）,13761251378,浦东新区杨高南路1126-1128号（卜蜂莲花超市地下车库）,09:00-21:00
上海市,上海,韦纳奇（车源汽车维修服务中心）,13761455651,嘉定区仓场路55弄81号,09:00-18:00
上海市,上海,质缘汽车服务有限公司,13162756868,浦东新区浦东南路1756号,09:00-18:00
上海市,上海,车丽坊汽车服务中心,15000916628,嘉定区仓场路39号,09:00-18:00
上海市,上海,1车1库（康锦路店）,18856445698,浦东新区康锦路32-42号,09:00-18:00
上海市,上海,嘉实多（上海盟昱汽车维修）,18616099851,嘉定区棋盘路775号,08:00-19:00
上海市,上海,爱座驾汽车养护专家（七浦路店）,15316666096,虹口区七浦路133号（兴旺服饰城B2）,08:00-19:00
上海市,上海,固特异（洛川中路店）,13916340899,静安区洛川中路810号,08:00-18:00
上海市,上海,云和汽车装潢,18017479716,嘉定区嘉罗公路1305号（东门加油站对面）,06:00-18:00
上海市,上海,爱座驾（汶水路店）,15618282097,静安区汶水路1555号（红星美凯龙地下一层）,09:00-18:00
上海市,上海,车享家（江场西路店）,02166980023,宝山区江场西路1677号,08:40-17:30
上海市,上海,车来车往汽车美容会所（嘉罗店）,18221830001,嘉定区嘉罗公路1462—1464号,08:00-19:00
上海市,上海,共明汽修,13601846582,嘉定区澄浏中路3622号,08:00-18:00
上海市,上海,车车翔（靚钦坊城南路店）,18917865590,浦东新区惠南镇城南路948-956号,09:00-18:00
上海市,上海,邓禄普(恒信汽车养护中心),13482185308,宝山区菊太路1439-1441号（好日子大家园D区隔壁）,06:00-18:00
上海市,上海,车饰界汽车养护中心,15026596311,浦东新区惠南镇城南路1077号,09:00-18:00
上海市,上海,玛吉斯（上海修慈汽车修理）,13311920827,嘉定区嘉罗公路1455号,08:00-19:30
上海市,上海,智车行快修连锁（曲丹修理厂）,15000429209,浦东新区惠南镇城南路1362号,09:00-18:00
上海市,上海,合能(风翼汽车服务),13564095357,宝山区锦秋路695弄40号,08:00-17:00
上海市,上海,良骑汽车服务（花木店）,13122981298,浦东新区海桐路338号（世纪联华停车场）,08:30-19:00
上海市,上海,壳牌（意诚汽配商行）,13370080088,虹口区华昌路174-176号,09:00-18:00
上海市,上海,车车翔（芳华路店）,02158826226,浦东新区芳华路1012号,09:00-18:00
上海市,上海,倍耐力（上海杰锐汽车修理）,13621880686,静安区平型关路712-718号,08:00-18:00
上海市,上海,车车翔（银霄路店）,15000301081,浦东新区银霄路276号,08:00-18:00
上海市,上海,威狮轮胎(佳佩汽车服务),15000683268,宝山区菊太路1183号,08:00-18:30
上海市,上海,美孚（轩驰汽修连锁）,13761237712,浦东新区书院镇船山街148号,08:00-19:00
上海市,上海,益鸣汽修连锁（拱北路店）,13965508499,浦东新区惠南镇拱北路539-541号,09:00-18:00
上海市,上海,米其林（上海惠固汽配有限公司）,02120790086,浦东新区惠南镇拱北路511-517号,09:00-18:00
上海市,上海,英飞润滑油（小解汽车维修中心）,13002195163,浦东新区惠南镇拱极路2269号,08:00-18:00
上海市,上海,上海皇家汽车俱乐部,13901886920,虹口区水电路75号,09:00-18:00
上海市,上海,素宏汽车美容,13661480178,浦东新区海科路777号,09:00-18:00
上海市,上海,嘉实多（上海闽伟汽车修理有限公司）,02160953036,浦东新区康桥东路1369号c栋101-106,08:00-18:00
上海市,上海,丽美汽车装饰,13524093770,静安区共和新路3228号（百安居停车场）靠近江场路,08:30-17:30
上海市,上海,嘉实多（熠彩汽车修理）,15216772826,虹口区岳州路367号,07:00-21:00
上海市,上海,尚车汇汽车工作室,13661502962,浦东新区惠南镇拱乐路856号,09:00-18:00
上海市,上海,马石油（德立汽车养护中心),13524835693,浦东新区惠南镇拱北路653号,09:00-18:00
上海市,上海,普利司通（小李轮胎服务中心）,13524743918,浦东新区川南奉公路5800号（下盐路南祝路加油站附近）,07:00-19:00
上海市,上海,KMC汽车美容养护中心,18621300850,宝山区顾太路30号,08:00-19:00
上海市,上海,轼马车生活馆,18964075998,杨浦区扬州路306号,09:00-18:00
上海市,上海,美孚（上海天吉汽配维修中心）,15618665068,浦东新区巨野路168-170号（栖山路口）,06:00-18:00
上海市,上海,恒扬汽车修理有限公司,15921855920,浦东新区川周路5655号,09:00-18:00
上海市,上海,嘉实多(上海柯尔汽车修理有限公司),15000598779,杨浦区周家嘴路2067号,09:00-18:00
上海市,上海,德国马牌（汶水东路店）,13817317982,虹口区汶水东路283号,08:30-19:00
上海市,上海,百世德（晟谦实业有限公司）,13801753674,虹口区场中路1003号,08:00-20:00
上海市,上海,净轩汽车服务,13816458068,虹口区奎照路427号,08:00-18:30
上海市,上海,大蜂车汽车养护中心（张江店）,13816046158,浦东新区华益路76号,08:30-18:00
上海市,上海,腾越汽车美容服务中心,17301828884,浦东新区张江路1278号（恒越大厦停车场内）,08:00-22:00
上海市,上海,魏风汽车服务,13651822669,浦东新区祝桥镇川南奉公路5552号,08:00-20:00
上海市,上海,朋兴汽车服务中心,18221116191,宝山区宝安公路教育路528号,08:00-18:00
上海市,上海,浩浩汽车俱乐部,18019233751,虹口区车站北路67号,09:00-18:00
上海市,上海,车服联盟（场北路店）,18616581743,宝山区场北路108-110号,09:00-18:00
上海市,上海,车车翔（德平总店）,02168562018,浦东新区德平路1217号（近杨高中路）,08:00-18:00
上海市,上海,轩阳汽车养护中心,02150330695,浦东新区德平路1128号,08:00-18:00
上海市,上海,兄弟车行,13788928517,浦东新区盛夏路1133号,08:00-20:00
上海市,上海,建铭车饰,13361815919,杨浦区国权后路5号,09:00-18:00
上海市,上海,车无敌汽车美容会所,18001839690,杨浦区控江路1437号,08:00-20:00
上海市,上海,一晨汽车服务,15021330360,浦东新区祝桥镇天竹路1号,07:00-19:00
上海市,上海,车之友汽车服务,15221316461,宝山区联谊路407号,09:00-18:00
上海市,上海,美孚（徐创汽车服务）,15317899903,嘉定区曹新公路1489号,08:00-18:38
上海市,上海,上海悦鑫汽车专项修理有限公司,13651854729,杨浦区国权路93-2号,08:00-19:00
上海市,上海,上汽大众(申荣汽车销售有限公司),18221283282,杨浦区宁武路10号,08:30-17:30
上海市,上海,靓车洁汽车美容连锁机构,13301619611,宝山区联泰路403-～405,08:00-21:00
上海市,上海,A+汽车养护大师（龙之加快修连锁）,15059980808,杨浦区双阳支路22-4号,08:00-17:40
上海市,上海,爱车一族（永吉店）,15221329380,杨浦区永吉路280号,09:00-18:00
上海市,上海,固特异（悠悦汽车服务）,18521312308,宝山区恒高路150号,08:00-20:00
上海市,上海,嘉实多（酷杰汽车服务）,13916547436,杨浦区辽源东路62-66号,08:00-18:00
上海市,上海,车车翔（云山路店）,02158503861,浦东新区云山路600号,09:00-18:00
上海市,上海,安捷通（金桥店）,17740871884,浦东新区金桥路2622弄59号,08:30-17:30
上海市,上海,邓禄普（上海沪辰汽车服务有限公司）,13661762633,宝山区红林路557号,09:00-18:00
