广东省,广州,畅途（南沙碧桂园店）,02034669292,南沙区进港大道12号（南沙碧桂园物业服务中心后）,09:00-18:00
广东省,广州,新福达汽车维修中心,15920187605,南沙区珠电路29号,08:00-19:00
广东省,广州,炫车汽车服务,13632671570,南沙区双山大道时代云图7栋,09:00-18:00
广东省,广州,共盈汽车养护中心,15999968330,南沙区环市大道中滨海半岛1号,09:00-19:00
广东省,广州,匡润汽车服务中心,18665063575,南沙区金洲巷5号(万达广场斜对面),09:00-18:00
广东省,广州,畅途（南沙滨海半岛店）,02032092083,南沙区环市大道中487号（世泰家具饰品城对面）,09:00-19:20
广东省,广州,畅途（南沙蕉门店）,02031158172,南沙区蕉门牌坊春风巷16号（蕉门牌坊旁）,09:00-19:20
广东省,广州,骏安汽车服务,13794364851,南沙区大岗灵山镇南路四街8号,08:00-18:30
广东省,广州,壳牌（博奥汽车一站式维修美容会所）,18924188067,南沙区大岗镇灵山江滘商贸城A58-A60号,08:00-19:00
广东省,广州,畅途（番禺东涌店）,02039010841,南沙区东涌镇东发二区1号楼38-46号（麦当劳背面）,09:00-18:00
广东省,广州,畅途（番禺石楼店）,02085821974,番禺区石楼镇崇山路8号路段厂房1号（原豪誉修理厂）,09:00-18:00
广东省,广州,祥珑汽车服务,13318711088,番禺区市莲路永善村段5号 ,09:00-18:00
广东省,广州,澳祺汽车生活馆,15902080077,番禺区石基镇前锋北路22号,09:00-18:00
广东省,广州,爱心汽车美容服务,13822115977,番禺区西田大街6号,07:00-07:00
广东省,广州,91星级养护中心,15915883036,增城区新沙大道北至利服装综合市场J12号,09:00-18:30
广东省,广州,两点养车（新塘店）,13760636311,增城区新塘镇新沙大道北86号,08:00-21:00
广东省,广州,两点洗车,13760636311,增城区新塘镇新沙大道北86号,08:00-21:00
广东省,广州,谊辉汽车美容护理中心,13427566380,黄埔区黄埔区经济技术开发区东江大道76号,09:00-18:00
广东省,广州,赛浪汽车服务连锁,15818170868,番禺区大龙街汉基广场B101号,07:50-19:00
广东省,广州,美车汇汽车服务,13267588718,增城区荔城街富力路45号,09:00-18:00
广东省,广州,飞达汽车服务,18028575769,番禺区大龙街傍江西村亚运大道花花世界51号,09:00-18:00
广东省,广州,德国马牌（车益汽车美容中心）,13763399628,增城区新塘镇新新大道南45号,09:00-18:00
广东省,广州,立星汽车服务中心,13538902910,增城区增城区新塘镇群星村新新大道99号,09:00-18:00
广东省,广州,利堡汽车服务,13928896013,增城区新塘镇白江路段新康花园北门田吓社耙岭三路24号,08:00-18:00
广东省,广州,新佳美汽车美容维修,13719376883,黄埔区保沙路16号,06:00-18:00
广东省,广州,爱义行（陈涌店）,02031065323,番禺区市南路239号,09:00-18:00
广东省,广州,振兴汽车修理厂,13719336408,黄埔区南岗街沙步社区宝沙路9号,09:00-18:00
广东省,广州,固特异（宝驰凯汽车美容护理中心）,18924163880,番禺区兴业大道东29号-104,08:30-18:00
广东省,广州,嘉实多指定换油（南岗店）,18565282920,黄埔区腾讯路1号,09:00-18:00
广东省,广州,车辕中高级车专修, 13726802047,番禺区富怡路447号（富怡车博城内）,08:30-18:00
广东省,广州,广州市豪杰汽车服务有限公司,13710482335,黄埔区南岗康南路13号（金航陶瓷旁300米）,09:00-18:00
广东省,广州,车仆汽车美容养护连锁（黄埔店）,13609740312,黄埔区康南路9号105档,09:00-18:00
广东省,广州,易合汽车服务有限公司,15217190909,番禺区市南路1号,09:00-18:00
广东省,广州,银马德系精修,17520440061,番禺区福德路501-505号,09:00-18:30
广东省,广州,莱骏汽车美容,020-32162787,增城区增城区凤凰城东门商业街163号铺,09:00-18:00
广东省,广州,比佛利专业汽车养护馆,13828448210,番禺区富华东路312号,08:30-18:30
广东省,广州,爵士联盟,15800240303,番禺区桥南街南堤西路17号,09:00-18:00
广东省,广州,瓜子养车（富华东路）,13560089721,番禺区市桥街道富华东路158号,08:30-08:30
广东省,广州,管博士专业名车维修（富华店）,020846617467,番禺区市桥街富华东路130号（市桥派出所对面）,07:00-07:00
广东省,广州,畅途（市桥店）,02039259959,番禺区市桥东环路393-8号（芭比酒吧隔壁路口进入）,09:00-18:00
广东省,广州,博艺汽车美容店,13268228300,番禺区甘棠大道1号,09:00-18:00
广东省,广州,爱车@爱家汽车服务,13602798110,番禺区西环路1829号,09:00-18:00
广东省,广州,众邦汽车维修,13922300095,番禺区市桥镇市新路蔡1号,09:00-18:00
广东省,广州,朝阳轮胎（广州圣朝斯汽车配件有限公司）,13622829474,番禺区新造镇永兴路22号,09:00-18:00
广东省,广州,粤锋汽车维修有限公司,18138766818,番禺区南村镇坑头村金山大道指手岭4号（七星岗公园斜对面),09:00-18:00
广东省,广州,爱义行（增城城南店）,18665633928,增城区荔城镇西山村广汕路1号,08:30-18:30
广东省,广州,i车车美容养护中心,18922220504,黄埔区双井东路2号,09:00-18:00
广东省,广州,酷骏汽车美容店,18688209384,番禺区福龙路福涌小学西北门50米,08:00-18:00
广东省,广州,壳牌（览山汽车维修有限公司）,18022344268,番禺区沙头街西环路榄山村第三工业区南一号,09:00-18:00
广东省,广州,名驹一站式汽车服务中心,13928804445,番禺区东环街桥兴大道518-520号,09:00-18:00
广东省,广州,畅途（增城永和店）,02032856416,增城区永顺大道东33-34号（原回味鸡快餐厅）,09:00-18:00
广东省,广州,苣丰汽车维护美容中心,18680208928,增城区增江街纬五路43号(碧桂园荔园旁),08:00-19:00
广东省,广州,祥旭汽车维修中心,13632365726,黄埔区石化路广新路口康达楼大厦101-103,06:00-18:00
广东省,广州,碧辉名车维修服务中心,13380022180,番禺区南村镇里仁洞植地庄北约新村1号,08:30-19:00
广东省,广州,酬信汽车一站式维修美容服务中心,13068888872,番禺区南村镇番禺大道北670号,09:00-18:00
广东省,广州,战神汽车美容中心,15918718621,增城区荔城街翠岗路22号一层103-104号,08:00-20:00
广东省,广州,管博士专业名车维修（祈福店）,02039145998,番禺区祈福车站斜对面长华商业街A区1-6号,09:00-18:00
广东省,广州,广嘉汽车一站式维修服务连锁,18819159013,番禺区长华商业街2号,09:00-18:00
广东省,广州,洁护汽车美容中心,13822120206,增城区开园路西一巷21-22号,06:00-18:00
广东省,广州,汇奔泛禹汽车修理厂,13688889813,番禺区钟村镇钟汉路5号之2厂之10号铺,09:00-18:00
广东省,广州,优养一号（番禺钟村店）,02084787593,番禺区钟四工业区一路1号（嘉成商务大厦一层）,08:30-19:00
广东省,广州,黄埔区孖宝汽车美容中心,13726708533,黄埔区企岭东直街7号102铺,09:00-18:00
广东省,广州,宾得丽汽车保养中心,13434290420,番禺区钟村镇锦绣生态园倚翠苑西区六座218号（大夫山北门斜对面）,09:00-18:00
广东省,广州,一百零一汽车服务,13760662458,增城区荔城街富力路9号,09:00-18:30
广东省,广州,嘉实多（广嘉靓车行）,13822153122,番禺区钟村街道105国道致业科技首层A-001号,09:00-18:00
广东省,广州,维雅汽车养护中心,02089854393,黄埔区珠村东环路128号,09:00-18:00
广东省,广州,007汽车美容一站式服务中心,13825041018,番禺区105国道谢村路段7号,08:30-19:30
广东省,广州,车来车往龙马汽车修理厂,13226659060,天河区汇彩路盈汇街96号,09:00-19:00
广东省,广州,广州市全天候汽车服务有限公司,13926050631,天河区珠村东环路138号,09:00-18:00
广东省,广州,中为润滑油（爱车汇汽车维修美容服务中心）,02022308865,天河区东圃镇官溪石官路10号,09:00-19:30
广东省,广州,名车坊汽车美容维修中心,13423685126,天河区珠村灵山东路2号,08:00-19:00
广东省,广州,洪仔汽车维修,13728063084,天河区奥体南路3号,09:00-18:00
广东省,广州,万力轮胎（东圃新时速汽车美容中心）,18898494168,天河区中山大道中247号（新圃加油站内）,08:30-19:00
广东省,广州,广州市天河区大力钣手汽车维修服务中心,17701909603,天河区天河大道车陂龙口大街3号,06:00-18:00
广东省,广州,车厘子车汇,02022098188,天河区棠东东路8号,09:00-18:30
广东省,广州,珍宝利汽车会馆,13660710132,天河区大观南路9号,09:00-18:00
广东省,广州,广州市车都汽车维修有限公司,020-85545380,天河区棠下涌东路2号,09:00-18:00
广东省,广州,捷时铧（旗舰店）,4000787854,天河区员村四横路6号,09:00-18:00
广东省,广州,广州市跃通汽车修理厂,18565432123,天河区临江大道员村二横路296号,09:00-18:00
广东省,广州,广州市车马炮汽车维修服务有限公司,020-34275371,海珠区江海大道红卫村中华大街34号,06:00-18:00
广东省,广州,畅途（中山大道西店）,02085672551,天河区中山大道西与荷光路交汇处（大舜丽池国际酒店停车场入口对面）,09:00-18:00
广东省,广州,嘉实多（志诚汽修）,13694262533,番禺区新城食街73号,09:00-18:00
广东省,广州,天河东港汽车护理,13826120101,天河区员村西街东颖楼1层,09:00-18:00
广东省,广州,颂凯汽车服务,13538336504,天河区棠东古隆街18号,10:00-19:00
广东省,广州,宽途汽车（靓车会汽车维修美容服务中心）,18718888234,天河区黄埔大道中员村山顶恒隆街1号（家乐福停车场內）,09:00-18:00
广东省,广州,车艺汽车美容店,15875302778,海珠区敦和路207号101铺,09:00-18:00
广东省,广州,敦和汽车美容中心,13076716186,海珠区敦和路208总站停车场内,09:00-18:00
广东省,广州,宜修汽修连锁,18818861286,天河区枫叶路加拿大花园北行50米（饶平鱼仔路口内进到底太空羽毛球馆旁）,09:00-18:00
广东省,广州,宽途汽车（瑞丰汽车维修服务部）,13535564466,海珠区南洲北路海新街11-19号首层3号铺,09:00-18:00
广东省,广州,畅途（黄陂天鹿花园店）,02082036616,黄埔区黄陂朱家街惠联路华标峰湖御景东行50米（华扬机械厂内）,09:00-18:00
广东省,广州,盛高汽修,13430368198,海珠区旧机械城19号,09:00-18:00
广东省,广州,速代驾（光和汽车一站式服务),13119582293,海珠区工业大道南889号,08:00-19:30
广东省,广州,畅途（广汕路店）,02087036773,天河区广汕二路127号（原路路顺车艺馆）,09:00-18:00
广东省,广州,纳能（盛高汽车美容服务中心）,13430368198,海珠区江南大道南889号,09:00-18:00
广东省,广州,海珠区领航汽车维护服务部,15800216667,海珠区江燕路287号,08:30-19:00
广东省,广州,爱车港汽车养护中心,13348790726,海珠区新港西路40号江南新苑地下停车场A6栋负一层,09:30-18:30
广东省,广州,怡乐汽车美容中心,020－29827789,海珠区怡乐路45号,09:00-18:00
广东省,广州,千禧汽车养护中心,13723542316,海珠区怡乐西街6号,09:00-18:00
广东省,广州,驰加(钦州湾大道店）,13607777592,越秀区钦州湾大道（名典商务酒店一楼）,09:00-18:00
广东省,广州,中化卡尔汽车服务连锁,13826297879,海珠区昌岗中路礼岗路5号（加油站内）,06:00-18:00
广东省,广州,车程汽车会所,18620809205,荔湾区东沙荷景路92号,09:00-18:00
广东省,广州,KB汽车美容生活馆,13602442447,天河区广州大道中918号（天龙酒店内停车场）,09:00-19:00
广东省,广州,好车汇汽车美容,18520655033,天河区长兴路长湴西大街1号,09:00-18:00
广东省,广州,福来汽车美容中心,13650986051,海珠区江湾路49号（江湾桥南往北桥脚前）,08:00-17:30
广东省,广州,拓美汽车美容护理,17612057265,海珠区江湾路29号,06:00-18:00
广东省,广州,广州市园林东风牌汽车技术服务站龙洞分站,13527860060,天河区龙洞北路324号,09:00-18:00
广东省,广州,广州骏菱汽车维修保养服务中心,15989217519,天河区龙洞龙湖路1号,08:30-20:00
广东省,广州,车神会,15914364570,荔湾区冲口街道鹤洞路346号万商茶都B20-23号,09:00-23:00
广东省,广州,车公馆汽车服务中心(凤凰新村店),13825005262,海珠区工业大道北55号,09:00-18:00
广东省,广州,广州市荔湾区恒进汽车美容店,18319248278,荔湾区花地大道中芳村坑口坑泉路牌坊1-3铺,08:00-18:30
广东省,广州,广州沙河一汽丰田特约店,13714446202,天河区广州大道北991号,09:00-18:00
广东省,广州,德国马牌（骏通汽车美容店）,13822186086,荔湾区龙溪大道281号,08:30-19:00
广东省,广州,车至尊汽车美容中心（荔湾店）,13533495899,荔湾区东漖北路23号,08:00-20:00
广东省,广州,同合汽车美容,18680537558,白云区同和街老庄村英豪街5号6房,09:00-18:00
广东省,广州,车一车汽车用品商行,020-88902556,越秀区东风西路120号05铺,08:30-18:00
广东省,广州,海角红楼汽车服务中心,15014218872,荔湾区桥中路坦尾8号（海角红楼旅游度假酒店内）,09:00-18:00
广东省,广州,广州正大捷诚汽车维修有限公司,02086378589,白云区向云东街4号,06:00-18:00
广东省,广州,广州市南丰汽车维修服务有限公司,13503087798,白云区机场路260号,09:00-18:00
广东省,广州,宽途汽车（越东汽车美容护理中心）,13316038107,白云区同德街田心西路202号,09:00-18:00
广东省,广州,皇马汽车美容,13632833075,白云区永平街解放庄北街1号,09:00-18:00
广东省,广州,盈捷洗车,13430280823,白云区明珠北路12号,09:00-18:00
广东省,广州,靓车一族汽车服务(黄石店),13903006254,白云区黄石东翰云路313号,09:00-18:00
广东省,广州,广州金工汽车维修有限公司,15913160961,白云区东平北路186号,08:20-20:00
广东省,广州,纳能（良安汽车养护中心）,15975362676,白云区米龙东中一街与116省道交叉口西北50米,09:00-18:00
广东省,广州,御荟汽车美容服务中心,13808861912,白云区汇桥中路29号,09:00-18:00
广东省,广州,源丰车养护,18565466796,白云区棠涌村佳园路纵横缤城1楼23号,09:00-18:00
广东省,广州,德国力魔（众友汽车维修服务中心）,13631485708,白云区黄边北路68号,09:00-18:00
广东省,广州,倍耐力（万鸿汽车维修太和店）,13503055371,白云区太和和乐花园北(太和中学东北),08:00-20:30
广东省,广州,永驰晟汽车美容中心,13066332681,白云区广从路永兴村（天鸿花园正门旁）,09:00-18:00
广东省,广州,嘉实多（创亨汽车专业维护中心）,020-29831877,白云区增槎路1133号,09:00-18:30
广东省,广州,嘉实多（爱车坊）,13480259092,白云区石槎路金碧新城1051号铺,09:00-18:00
广东省,广州,驾道汽车美容维修服务中心,13144447450,白云区嘉禾百花岭南街1巷2号,09:10-18:30
广东省,广州,星辉汽车一站式服务中心,18664786026,白云区嘉禾街七星岗商业街37-38号,08:00-22:00
广东省,广州,穗埔汽车维修厂,020-36631056,白云区太和镇广从三路88号,09:00-18:00
广东省,广州,韩泰轮胎（龙归天缘汽车维修有限公司）,18620000288,白云区均禾街新科新石路1号A栋一层,09:00-18:00
广东省,广州,极爱车品,18591759299,白云区均禾大道1183号,09:00-19:00
广东省,广州,宽途汽车（恒源汽车养护中心）,13676228167,白云区龙归南岭村富森鞋厂西南70米(兴龙花园对面),09:00-18:00
广东省,广州,壳牌（金鑫鑫汽车养护）,18565455066,白云区石井大道262号（银马男装正对面）,06:00-18:00
广东省,广州,优部汽车服务中心,13725321817,白云区石井镇红星村红星工业路17号,09:00-18:00
广东省,广州,建兴汽车修理,13924248257,白云区石马加石路21号,09:30-18:30
广东省,广州,邓禄普轮胎（广州市白云区新晖轮胎服务中心）,13751771237,白云区均禾街石加路26号,09:00-18:00
广东省,广州,铭声坊汽车音响,13600006382,白云区太和镇龙归北村北太路19号,09:00-18:00
广东省,广州,车e族汽车服务中心,13160888360,白云区均禾街石马村夏花一路38号,09:00-18:00
广东省,广州,辉驰汽车一站式服务中心,13078821103,白云区钟落潭镇钟车路14-16号,07:30-23:30
广东省,广州,腾达汽车一站式服务,020-28175099,白云区石井大道龙湖逸龙工业区,09:00-18:00
广东省,广州,昌盛汽车快速维修中心,13286829538,白云区人和镇新兴村委会前东南500米,09:00-18:00
广东省,广州,锐成汽车养护服务中心,13178812100,白云区人和镇鹤龙七路128号,09:00-18:00
广东省,广州,铭驹汽车服务中心,13538804178,从化区从化区从城大道120号(汽车站前100米）,09:00-18:00
广东省,广州,途乐汽车养护中心,13431013938,花都区新雅街广塘村白蟮塘106国道1桥旁,09:00-18:00
广东省,广州,花都新君鸿汽车养护中心,13926131873,花都区新雅街岑镜东七巷2号,08:00-20:00
广东省,广州,盛佳汽车养护中心,13249133912,花都区雅源南路（悦丰宾馆旁向西100米左右）,09:00-18:00
广东省,广州,坚诚汽车服务中心,13600011145,花都区新华街曙光路11号(田美小区旁),09:00-18:00
广东省,广州,66汽车生活馆,18520070312,花都区云山大道44号,09:00-19:00
广东省,广州,壳牌（一路鸿运来专业汽车服务）,18026203879,花都区新街大道望亭路1号,09:00-18:00
广东省,广州,典典养车（车轮战店）,13660585124,花都区新华松园路14号松园大厦6-9铺,09:00-18:00
广东省,广州,亿通汽车美容维修,13044213792,花都区建设北路鼎信四季花园211号70-72铺,08:30-19:00
广东省,广州,典典养车（汇航店）,13533888189,花都区狮岭大道东7号19-20商铺（狮城国际对面）,08:30-19:30
广东省,广州,典典养车（华昊店）,13926286867,花都区狮岭镇金狮大道东54号,09:00-18:00
广东省,广州,从化创越汽车服务中心,13503082684,从化区从化区鳌头镇新政路5号一层（工商银行旁）,08:00-18:00
江苏省,苏州,兴隆汽车美容装潢,18913075178,吴江区桃花源大道1076号,09:30-16:30
江苏省,苏州,福祥汽车服务中心,13621577622,吴江区华盛大道326号,07:30-17:30
江苏省,苏州,汽车之家（浔青路店）,15995570215,吴江区浔青路99号,08:00-23:59
江苏省,苏州,爱车族汽车护理养护中心,13913720300,吴江区迎春路3号,07:30-22:00
江苏省,苏州,清风汽车美容装潢,18537716688,吴江区吴越北路6038号,07:00-20:00
江苏省,苏州,德林特（胡万里汽车）,13912735866,吴江区望湖路1577号,07:51-17:30
江苏省,苏州,宝利达快修,18662115331,吴江区八都前贯线与207县道交叉口南150米,09:00-18:00
江苏省,苏州,超可依汽车养护中心,18721613221,吴江区頴塘路2470号,07:00-21:00
江苏省,苏州,惠忠汽车养护中心,13951123970,吴江区庙震路642号,08:00-17:00
江苏省,苏州,镇夏洗车场,15050159661,吴中区梅园路镇夏华润超市对面,09:00-18:00
江苏省,苏州,隆昌汽车,13222260868,吴江区南环路1700号,09:00-18:00
江苏省,苏州,财神驾道（舜新南路店）,13862142206,吴江区舜新南路1008号,08:00-18:00
江苏省,苏州,欧威车业,15995505008,吴江区西环路知音华美达酒店旁,09:00-18:00
江苏省,苏州,领威（佳铭汽车养护中心）,15851653231,吴江区盛东路1968号,07:30-19:00
江苏省,苏州,德国马牌(金庭中远汽车修配厂),13358005018,吴中区金庭路75号,07:30-17:00
江苏省,苏州,天天爱车汽车美容中心,15862557611,吴江区梅堰汽车站向南1000米,09:00-18:00
江苏省,苏州,优科豪马(车之侣汽车修理),18912642230,吴中区洞庭路16号,09:00-18:00
江苏省,苏州,友谊汽车养护,18662110828,吴江区晨莺路13号,08:00-18:00
江苏省,苏州,长城（万通汽车维修中心）,18963688607,吴江区平运路32号,09:00-18:00
江苏省,苏州,和顺汽修,15050393039,吴江区平运路15号,09:00-18:00
江苏省,苏州,谊车汇汽车服务中心,15995501623,吴江区学才路3号,08:30-18:00
江苏省,苏州,车杰艺汽车一站式服务,1585003897,吴中区木东路8329号,08:00-21:00
江苏省,苏州,美之瑞养车馆,17775007892,吴中区环镇路西100米,09:00-18:00
江苏省,苏州,张亮汽车维修部,13776145866,吴江区黎里镇汤角集宿区卫生服务站右侧,09:00-18:00
江苏省,苏州,苏州杰尔盛汽车服务有限公司,18915588657,吴中区木东路6018号,09:00-18:00
江苏省,苏州,泽强车业,18362767970,吴中区锦福路155-157号,08:00-18:00
江苏省,苏州,宽途汽车服务中心,13771756991,吴中区和安路550号,09:00-18:00
江苏省,苏州,车饰美汽车装潢美容,13585985912,吴江区中山南路上亿国际汽车城19栋113—116号,08:00-18:00
江苏省,苏州,壳牌（华健汽修）,15862416533,吴中区泾市路52号,09:00-18:00
江苏省,苏州,车玛珂汽车养护中心,18914098748,吴中区横泾街道嘉盛花园1幢101室,07:00-20:00
江苏省,苏州,嘉实多(苏州车壹元汽车服务有限公司),15150205888,吴中区木东路7525号,08:00-18:00
江苏省,苏州,美瑞阁汽车一站式服务,18351636260,吴中区东山大道8号,09:00-18:00
江苏省,苏州,车朋轩汽车美容养护,13349099556,吴江区庞杨路城南花苑1519号,07:30-19:30
江苏省,苏州,宝盛汽车服务有限公司,18913595705,吴中区胥口吉祥路207号,07:00-20:00
江苏省,苏州,新焦点修理厂,18662210073,吴中区胥口茅蓬路968号,08:00-17:00
江苏省,苏州,车享家（苏州花园路店）,051263986831,吴江区松陵镇花园路1832-1836号,09:00-17:30
江苏省,苏州,德国马牌（壹车仆汽车服务连锁）,13913115525,吴中区孙武路601号西南方向70米,08:00-18:00
江苏省,苏州,车洁饰汽车美容会所,13906132506,吴江区笠泽路935号,09:00-18:00
江苏省,苏州,苏州旺山汽修,18651115751,吴中区旺山村路与生态路交叉口东150米,09:00-17:00
江苏省,苏州,APEX（知车坊）,13913715850,吴江区文苑路88号（东恒盛酒店停车场）,08:00-17:30
江苏省,苏州,爱马社汽修,18913509376,虎丘区西华路338号,08:00-18:00
江苏省,苏州,苏旺汽修,15956612881,吴中区旺山村路北150米,08:00-20:00
江苏省,苏州,格灵润滑（以勒车业）,13771685387,吴江区体育路125号,08:00-17:30
江苏省,苏州,爱车驿馆一站式服务中心,15162382120,吴江区交通南路2351号,07:50-19:00
江苏省,苏州,名旺汽车一站式服务中心,18896538192,吴江区通虹路127号,07:30-20:00
江苏省,苏州,祥瑞汽修（锦安小区）,17712675508,吴江区永康路与锦业路交叉口,08:00-20:00
江苏省,苏州,优科豪马轮胎（浩锦汽车服务）,13732646941,吴中区藏书穹灵路2483号,08:00-17:30
江苏省,苏州,锦湖轮胎(腾飞车业),15190097413,吴中区穹灵路2335号,07:30-20:00
江苏省,苏州,车享家（苏州垂虹路店）,051263969635,吴江区松陵镇花园路2318号27,28#,09:00-17:30
江苏省,苏州,苏州美丽基业汽车维修服务有限公司,13814816113,虎丘区绣品街396号,09:00-18:00
江苏省,苏州,缘车汽车一站式服务（垂虹路店）,18012735855,吴江区垂虹路52号,09:00-18:00
江苏省,苏州,捷腾汽车美容,15962577728,吴江区垂虹路173号,09:00-18:00
江苏省,苏州,靓车一族汽车服务,15995555995,吴江区江兴西路862号,09:00-18:00
江苏省,苏州,驰奔行汽车服务,15995610351,吴江区江兴西路860号,09:00-18:00
江苏省,苏州,车享家（苏州梅石路店）,051263986863,吴江区梅石路1629~1631号,09:00-17:30
江苏省,苏州,威狮轮胎(车福鑫汽车配件店）,13451526634,吴中区姑苏西路129号,09:00-18:00
江苏省,苏州,车亿友一站式汽修,18962119026,吴中区方家桥小区107号,09:00-18:00
江苏省,苏州,苏州梦园汽车维修服务有限公司,18762892248,吴中区孙武路54号,09:00-18:00
江苏省,苏州,舒车堂汽车养护会所,18626157836,吴中区姑苏西路11号,08:00-17:00
江苏省,苏州,汾湖汽车维护有限公司,13004568822,吴江区金厍路238号,08:00-17:00
江苏省,苏州,百汇汽车美容部,18762945650,吴江区江兴西路563号,09:00-18:00
江苏省,苏州,壳牌（明达汽修）,13914058062,吴中区庄马路58号,09:00-18:00
江苏省,苏州,吉龍快车道,18551134292,吴江区鲈乡北路与江兴西路交叉口,08:00-21:00
江苏省,苏州,普利司通（于淼轮胎配件有限公司）,13855764248,吴中区庄马路341号,07:00-18:00
江苏省,苏州,小马汽修美容中心,17768012935,吴中区庄马路373号,07:30-19:30
江苏省,苏州,三人行汽车养护中心,13063763796,吴江区北门街155号,08:00-18:00
江苏省,苏州,君利来汽车服务有限公司,15950078609,吴中区庄马路287号,08:00-19:00
江苏省,苏州,嘉实多(德奥行汽车一站式服务),13915532334,吴中区庄马路291号,08:00-19:00
江苏省,苏州,壳牌(玛吉斯轮胎汽车服务中心),15150144781,吴中区庄马路88号,09:00-18:00
江苏省,苏州,车之居汽车1站式服务,15262519777,吴江区江兴西路400号,08:30-17:30
江苏省,苏州,洗车人家（松陵店）,13771953012,吴江区交通南路3336号,09:00-18:00
江苏省,苏州,美孚(宝驰汽车生活馆),13451554166,吴中区溪翔南路124号,08:00-18:00
江苏省,苏州,飞越汽车养护中心,15262355719,吴江区工农路101-105号,08:30-18:30
江苏省,苏州,车洁美一站式服务中心,13771877114,吴江区交通路3326号,08:00-18:00
江苏省,苏州,至达美汽车,15051726798,吴江区运东农贸外22号,08:00-20:00
