江苏省,苏州,养车坊汽车服务中心（华寓路店）,13584993260,昆山市华寓路与石鑫路交口东行50米路北（环湖佳苑1号楼）,07:30-18:00
江苏省,苏州,茂林汽修,15062666041,昆山市华寓路与石鑫路交口东行50米路北（环湖佳苑1号楼）,07:00-20:00
江苏省,苏州,路欧峰（小蒋汽车美容）,18112757505,常熟市尚湖大道工商银行旁,09:00-18:00
江苏省,苏州,快捷汽车服务,18361997311,昆山市蓬溪北路882号,07:00-19:00
江苏省,苏州,华云汽车服务中心,13584900236,昆山市蓬莱路53号,06:00-23:59
江苏省,苏州,恒源汽修一站式服务,18914978690,昆山市益伸路489号,09:00-18:00
江苏省,苏州,车享家（苏州常熟汇金一路店）,051252179130,常熟市湖山路333号同济科技广场2号楼114-116室,09:00-17:30
江苏省,苏州,嘉实多（昆山至尊汽车服务）,18068074772,昆山市周新路与永工路交叉口西南150米,08:00-18:00
江苏省,苏州,勇顺汽车服务部,15962483177,常熟市三塘路234号,07:00-22:00
江苏省,苏州,枫林汽车,13372127333,常熟市枫林路205号,09:00-18:00
江苏省,苏州,养车堡汽车养护中心,13915584237,常熟市琴湖广场五号楼121号,08:30-17:00
江苏省,苏州,固特异轮胎（太仓启驾汽车）,15051632161,太仓市东古路2号,07:30-18:30
江苏省,苏州,车享家（苏州太仓新华西路店）,051253662760,太仓市县府西街158号君悦豪庭北区商铺5-3 6-1 6-2商铺,09:00-17:30
江苏省,苏州,速锐汽修服务部,15895563011,太仓市东古路2-28号,08:00-18:30
江苏省,苏州,韦尔斯（路路通汽车美容装饰中心）,15851519694,常熟市琴湖路268号,09:00-18:00
江苏省,苏州,欧帕斯（靓车点汽车装饰）,13814583489,太仓市长春南路12号,07:30-17:30
江苏省,苏州,车友之家（金顺汽车）,13358021089,常熟市青墩塘路98号,08:00-18:00
江苏省,苏州,邓禄普轮胎（富康汽车美容装潢）,13962498245,常熟市富康路16号,09:00-18:00
江苏省,苏州,车佰汇汽车一站式服务,18551118218,太仓市上海西路53号,09:00-18:00
江苏省,苏州,壳牌(甬江汽车维修养护中心),13773027463,常熟市甬江路20号,09:00-18:00
江苏省,苏州,畅速汽车养护中心,18796893073,太仓市长春北路9-2号,08:00-22:00
江苏省,苏州,车享家（苏州常熟黄河路店）,051252832163,常熟市黄河路777号佳和商业中心5幢103号,09:00-17:30
江苏省,苏州,欧罗来（新感觉汽车）,18550029720,常熟市珠江路168号,09:00-18:00
江苏省,苏州,鑫顺汽车美容装潢中心,18151575556,常熟市李闸路395-1号,09:00-18:00
江苏省,苏州,菱威汽车服务有限公司,18913689812,常熟市文学街722号,08:00-17:00
江苏省,苏州,诚力好先生,13306223753,太仓市人民北路30号,08:00-18:30
江苏省,苏州,车享家（苏州常熟珠江东路店）,051252416231,常熟市珠江东路世贸世纪中心-创富世纪3幢103-104号,09:00-17:30
江苏省,苏州,洗车人家（锦州路口店）,13862295812,太仓市朝阳路锦州路口,09:00-18:00
江苏省,苏州,德国马牌（宁鸿汽车）,15962494699,常熟市文学街与金源路交叉口,09:00-18:00
江苏省,苏州,百隆汽车一站式服务,15051661331,太仓市朝阳东路22号,09:00-18:00
江苏省,苏州,雷霆车友,15150379771,常熟市勤丰路53号,09:00-18:00
江苏省,苏州,爱车计划服务连锁,18552019669,太仓市太平北路66号,08:30-17:30
江苏省,苏州,航顺达汽车美容,15851560763,常熟市古里镇政府斜对面,07:30-18:00
江苏省,苏州,邓禄普（凤凰车浩饰洗车行）,15366261338,张家港市凤凰路40-15号,07:00-20:00
江苏省,苏州,思家车,18795490582,太仓市郑和中路万鸿塞纳丽舍21号楼,09:00-18:00
江苏省,苏州,凯特一站式服务中心,15162569486,常熟市老街静海路老街一期南门对面,06:30-19:00
江苏省,苏州,车享家（苏州太仓滨河东路店）,051253577235,太仓市滨河路168-34号,09:00-17:30
江苏省,苏州,车享家（苏州太仓郑和中路店）,051253201013,太仓市郑和中路376号塞纳丽舍20幢8号一层,09:00-17:30
江苏省,苏州,胜华车业有限公司一站式服务,15051497719,常熟市常浒路2888号,08:00-20:00
江苏省,苏州,卡卡爱车俱乐部,13182682112,太仓市郑和中路65号,09:00-18:00
江苏省,苏州,精诚汽车养护中心,15861633165,张家港市凤凰镇栏杆桥100号,07:00-20:00
江苏省,苏州,睿洗超级中心,17388493801,太仓市天津路100号,09:00-18:00
江苏省,苏州,壳牌（睿翔汽车服务）,18656507899,太仓市大庆雍景苑4幢9号,08:30-17:10
江苏省,苏州,东昇杰汽车美容装潢,15851625235,张家港市吴湖路1号,09:00-18:00
江苏省,苏州,玛吉斯（新港中路店）,15051504421,太仓市新港中路50号,06:30-21:30
江苏省,苏州,道达尔（车世家汽车养护）,18921973351,张家港市凤凰大道双龙花园小区5号底商,09:00-18:00
江苏省,苏州,爱车地带汽车维修一站式服务,15962332863,常熟市常浒公路32号（大虹桥警务室旁）,07:00-18:00
江苏省,苏州,浩羽汽车养护,13862227872,张家港市东区大道与汤联路交叉口西150米,08:30-16:30
江苏省,苏州,鸿安汽车养护中心,15666902928,太仓市常胜北路50号1幢101室,09:00-18:00
江苏省,苏州,168汽车俱乐部旗舰店,13773269606,张家港市金港大道338号,09:00-18:00
江苏省,苏州,德国马牌（顺发汽车服务广场）,18351709921,张家港市镇北路26号,07:00-20:00
江苏省,苏州,锦源汽车维修养护中心,13665185307,张家港市凤凰镇西张西秒路金谷小区九栋105,09:00-18:00
江苏省,苏州,车护士汽车美容装潢（金港镇）,15358896445,张家港市江海南路39号,09:00-18:00
江苏省,苏州,车仕多汽车一站式服务,13338027125,常熟市西环路2号108室,07:30-23:59
江苏省,苏州,金典汽车美容装饰服务部,18962286736,张家港市馨苑路61-63号,09:00-18:00
江苏省,苏州,车享家（苏州张家港馨苑路店）,051256900019,张家港市杨舍镇湖东花苑房号7幢-M5,09:00-17:30
江苏省,苏州,宣路达汽车一站式服务,15995590922,太仓市板桥路113号,07:00-19:00
江苏省,苏州,骆驼蓄电池(云修连锁汽车服务中心）,15298806695,张家港市文星南路后塍新塍小区大门口,09:00-18:00
江苏省,苏州,车管家汽车装饰服务部,17351256787,张家港市东山南路68号,07:00-23:00
江苏省,苏州,美车堂(小菜巷路店),15851666181,张家港市小菜巷路25号,08:00-17:00
江苏省,苏州,快乐洗车中心（浦家湾弄店）,18013615767,张家港市浦家湾弄15号,07:00-17:00
江苏省,苏州,酷车派汽车美容,18021639281,常熟市塘湾路路与海港线交叉口,08:00-23:00
江苏省,苏州,龙捷快修（客运站店）,17751191811,张家港市华昌南路3号,09:00-18:00
江苏省,苏州,优科豪马（天涯汽车美容装饰）,18118113315,张家港市河西南路95号,07:00-19:30
江苏省,苏州,德国马牌(支塘店),18761887855,常熟市宝芝路1幢137号,09:00-18:00
江苏省,苏州,欧罗来（零距离车饰）,15371881803,常熟市香州路15号,08:00-18:00
江苏省,苏州,车享家（苏州张家港东环路店）,051258261196,张家港市东环路皇家首座23-27号,09:00-17:30
江苏省,苏州,诚辉汽车换油服务中心,13914908700,张家港市水站陆家巷37号,08:30-18:00
江苏省,苏州,车享家（苏州张家港南苑东路店）,051258261192,张家港市南苑东路29号帝景豪园南门10栋35号,09:00-17:30
江苏省,苏州,腾飞汽修有限公司,18550303097,太仓市印溪南路1111号,08:50-23:00
江苏省,苏州,阿特拉斯轮胎（建宏汽车）,13262988855,张家港市港城大道182号,09:00-18:00
江苏省,苏州,酷车汇汽车服务部（沙溪店）,13771161351,太仓市沙南西路98号,08:00-19:00
江苏省,苏州,车臣汽车美容养护中心,18626221265,太仓市中市东路东方雅苑6-1号,09:00-18:00
江苏省,苏州,美泊莱汽车维修服务中心,18021640935,张家港市天台南路156号,09:00-18:00
江苏省,苏州,百援汽车连锁服务中心,18915672868,张家港市黄泗浦西路137号,06:00-18:00
江苏省,苏州,锦鸿汽车养护中心,19951183199,张家港市通贸街78号,08:00-22:00
江苏省,苏州,完美汽车美容（沙溪店）,18913769575,太仓市新北西路56号,09:00-18:00
江苏省,苏州,玛吉斯（车之恋换油养护服务有限公司）,18605120494,张家港市敬安路8号,08:00-17:00
江苏省,苏州,光明汽修,13962235101,张家港市蒋乘路28号,07:30-18:00
江苏省,苏州,博世汽车专业维修（金港镇店）,13776099446,张家港市中圩路与江海中路交叉口东150米,07:40-17:30
江苏省,苏州,车享家（苏州张家港第三站店）,051267420282,张家港市张杨公路体育馆旁,09:00-17:30
江苏省,苏州,奔帝汽车美容装潢服务部,18962411982,太仓市印溪东路662号,09:00-18:00
江苏省,苏州,博胜汽车服务有限公司,18551111366,太仓市印溪东路662号,09:00-18:00
江苏省,苏州,超人汽车会,18662637793,张家港市中港北路3号,08:53-18:34
江苏省,苏州,米其林（中兴路店）,15962395313,张家港市中兴路红绿灯东10米,09:00-18:00
江苏省,苏州,张家港凯瑞达汽车养护装潢中心,18921997117,张家港市和鑫路和鑫花园社区对面,09:00-18:00
江苏省,苏州,锦鸿汽车维修美容中心,13862319969,常熟市府前路欧德福超市后面,07:30-19:00
江苏省,苏州,翔顺汽车装潢部,18962338536,常熟市梅北路55-19号,09:00-18:00
江苏省,苏州,广东顺发汽车装潢,15051767317,常熟市人民路92号,09:00-18:00
江苏省,苏州,壳牌（红燕汽车维护服务部）,13773033046,常熟市梅北路81号,09:00-18:00
江苏省,苏州,爱尚车汽修美容,13041898060,常熟市通江路26号,09:00-18:00
江苏省,苏州,金标汽车换油服务中心,18550134030,张家港市银苑中路与银苑西路交叉口西50米,09:00-18:00
江苏省,苏州,车百科汽车装潢美容,15301572991,常熟市人民路76-78号,07:00-20:00
江苏省,苏州,玛吉斯轮胎（德成鑫汽车养护服务部）,13913636201,常熟市梅李镇交警中队北100米,07:00-21:00
江苏省,苏州,正新轮胎（车之佳汽车养护）,13814994844,常熟市何市公交车站斜对面,09:00-18:00
江苏省,苏州,强盛汽车美容装潢中心,051253290857,太仓市归北路18号,09:00-18:00
江苏省,苏州,小广汽车装饰,13862287123,太仓市郑和路888号,07:30-17:30
江苏省,苏州,爱车宝汽修店,13651702262,太仓市郑和东路88-4号,06:00-18:00
江苏省,苏州,牌楼汽车美容生活馆,15150317172,太仓市浏双线117号,07:00-18:00
江苏省,苏州,小广东车饰,13814911202,常熟市新溪路38号,09:00-18:00
江苏省,苏州,泉鑫汽车养护,16605204619,张家港市新联花苑37幢26-27号,07:40-18:00
江苏省,苏州,通达汽车维修汽配,15150202046,张家港市杨锦公路56号,06:00-23:00
江苏省,苏州,美邦汽车,15250365076,张家港市府前路阳光家园北门M03号,08:00-18:00
江苏省,苏州,益思特汽车服务中心,17625396290,张家港市府前路富华佳园2-30号 ,08:00-18:30
江苏省,苏州,靓车贝贝汽车美容中心,18136982808,张家港市合兴悦来三村西门卫,06:30-23:59
江苏省,苏州,永通汽修,13952420755,太仓市龙江路大转盘向北200米路东侧,09:00-18:00
江苏省,苏州,车世界美容会所（璜泾店）,17351717802,太仓市璜泾沙鹿路新华侨,09:00-18:00
江苏省,苏州,小鲍汽车美容中心,13196614801,太仓市荣文路幼儿园向东400米,07:00-19:00
江苏省,苏州,捷豪汽修,13776286977,太仓市新港东路上海春天小区靠东,09:00-18:00
江苏省,苏州,亿佳汽车美容装饰,13913689903,太仓市棉北路108号,05:30-20:00
江苏省,苏州,壳牌（晶秀汽车美容装潢）,13814580768,太仓市和平路南天主题酒店南100米,09:00-18:00
江苏省,苏州,闸北汽车美容装潢,15580853631,太仓市中兴街54号,09:00-17:00
江苏省,苏州,青中汽车美容装潢部,13962458158,张家港市乐兴南路星辰花苑9幢98号,09:00-18:00
江苏省,苏州,圣保路（天阳汽车车身维修）,13915702229,张家港市同德路1号,09:00-18:00
江苏省,苏州,盛达汽车换油中心,18913616196,张家港市华润路2号（金鹿集团正大门斜对面）,09:00-18:00
江苏省,苏州,洗车人家汽车服务（江海汇店）,15995995052,张家港市永新路与青年路交叉口（锦都中央广场1幢）,08:03-18:03
江苏省,苏州,车享家（苏州张家港永新路店）,051256956833,张家港市锦丰镇锦苑1幢104~107室,09:00-17:30
上海市,上海,佳通（上海齐虎汽车修理厂）,15921353412,金山区枫泾镇泾宾路581-583号,09:00-18:00
上海市,上海,壳牌（上海齐虎汽车修理厂）,13671698587,金山区枫泾镇枫阳路164号,08:00-18:00
上海市,上海,小拇指汽车微修（古城店）,18918800699,金山区古城路665号,08:00-18:00
上海市,上海,车贝捷汽车俱乐部,15821722960,金山区卫零路205号,08:00-19:00
上海市,上海,金富力（缘利汽修）,13917636457,金山区龙胜路679号,08:00-18:00
上海市,上海,胖子汽车装潢,02157960896,金山区东平南路537-541号,09:00-18:00
上海市,上海,忠良汽车养护,15021853166,金山区东平南路545-549号,07:00-21:00
上海市,上海,嘉实多（亮车汽车装潢维修）,13045643033,金山区城河路343号,08:00-17:30
上海市,上海,汽车1+2（东平南路店）,18918448720,金山区东平南路831号,08:00-17:00
上海市,上海,车车翔（学府路店）,13501857542,金山区金山卫镇学府路1800弄3,07:00-19:00
上海市,上海,米其林（老黄汽车装潢部）,13901935880,金山区金山大道2259-2261号,06:00-18:00
上海市,上海,统一合能（彭顺汽车服务中心）,13524810534,金山区龙山路496号,09:00-18:00
上海市,上海,伟明汽车装潢,18964812867,金山区朱泾镇众益街351-361号,09:00-18:00
上海市,上海,壳牌（浪城小许汽车维修）,13636526987,金山区朱泾镇罗星路560-564号,07:09-18:00
上海市,上海,顺宏汽车美容中心,13601890469,金山区山阳镇红旗东路124号,07:00-19:00
上海市,上海,佳通（车八度汽车服务）,18917829563,青浦区练塘镇练新路13号,06:00-18:00
上海市,上海,马石油（乐众汽车一站式维修中心）,02157382818,金山区亭枫公路2361号,09:00-18:00
上海市,上海,车宅保汽车服务,13651772073,松江区泖港镇中厍路300号,09:00-18:00
上海市,上海,美车壹站,13331932422,金山区亭林镇南亭公路6845弄13号,07:00-18:00
上海市,上海,德昕汽车服务中心,18217514990,松江区翔昆路70号,07:30-17:30
上海市,上海,小陈洗车行,13817517640,松江区文翔路5218弄118号,06:00-18:00
上海市,上海,上海丽纯环保科技有限公司,17721268622,青浦区康园路399弄2栋6号,09:00-18:00
上海市,上海,韩泰（应陆汽摩配件经营部）,15921828526,青浦区朱家角镇沙家埭路501号,07:30-19:00
上海市,上海,心蕾汽车服务中心,18221807596,松江区玉树路2158号,08:00-19:00
上海市,上海,宝瑞汽车服务中心,13681678170,松江区玉森路164号,08:00-18:00
上海市,上海,勇享车（飞航广场店）,13148161777,松江区玉树路2783号飞航广场地下停车库,09:00-21:30
上海市,上海,翔星汽车美容店,13524143522,松江区辰塔路1451号,07:30-18:00
上海市,上海,清忻汽车服务,15901658068,松江区文诚路2188弄430号,09:00-18:00
上海市,上海,勇享车（新理想城店）,13761214986,松江区荣乐西路860号（新理想城负一层C区）,08:00-18:00
上海市,上海,艺殊佳汽车生活馆,18001725119,青浦区朱家角镇祥凝浜路3-6号,09:00-18:00
上海市,上海,叶城汽车维修服务,13818113774,松江区叶榭镇叶政路1009号,09:00-18:00
上海市,上海,壳牌（煜飞汽车服务）,19945738926,松江区文涵路126号地下车库负一层,09:00-18:00
上海市,上海,世博汽车美容（朱家角店）,13681752936,青浦区浦泰路1306号,06:30-19:00
上海市,上海,车车翔（松江店）,02157821970,松江区荣乐中路847-859号（近西林北路）,09:00-20:00
上海市,上海,京东会（成远汽车服务）,15000988009,松江区环城路126-134号,08:00-20:00
上海市,上海,驰加（上海立民汽车装潢用品有限公司）,02157835552,松江区环城路730-738号近方塔北路口,07:00-18:00
上海市,上海,臻火汽修,18017800659,松江区松卫北路1846号,08:00-20:00
上海市,上海,好修养（上海松江坤轮汽车服务部）,13671888271,松江区南青路298号,09:00-18:00
上海市,上海,德国马牌（上海轮吉汽车服务维修部）,17855099866,松江区新松江路262号,08:30-21:30
上海市,上海,万力（联建村店）,13817944783,松江区车墩路车亭公路联建村113号,06:00-20:00
上海市,上海,艺养汽车（美容部）,15800365957,松江区荣乐东路1535号,08:00-17:00
上海市,上海,美孚（长久汽车服务有限公司）,13162533833,松江区宝荣路9号2幢,09:00-18:00
上海市,上海,DMS汽车养护中心,18001959567,松江区茸北路333弄1号东一层,09:00-21:00
上海市,上海,欧诺优（庆洋汽车服务）,18201729676,奉贤区环城南路1122号,08:00-19:00
上海市,上海,上海驰修汽服（奉贤大润发店）,02167100232,奉贤区南桥镇南亭公路601号（B1停车场）,09:00-18:00
上海市,上海,金富力（乔森汽车服务),18501618626,青浦区城中南路191-195号,09:00-18:00
上海市,上海,车靚汽车美容,18816518589,松江区影振路233号,08:30-18:30
上海市,上海,汇众汽车养护中心,17721081968,松江区广富林路1188弄（风情街地下室）,08:30-19:00
上海市,上海,车友汽车维修养护（陆航路店）,18062898564,奉贤区南桥镇陆航路211号,09:00-18:00
上海市,上海,车友汽车维修养护（新建西路店）,13818416141,奉贤区新建西路643号,09:00-18:00
上海市,上海,大蜂车（佘山店）,19121274967,松江区佘山镇桃源路378号,09:00-18:00
上海市,上海,臻帅汽车维修服务,15821959755,青浦区环城东路282-284号,06:00-18:00
上海市,上海,帅斌汽车美容养护中心,13482652068,松江区广富林路1188弄185号,08:00-21:00
上海市,上海,驰诚汽车服务,13381795669,青浦区盈港路1555弄23号,07:00-20:00
上海市,上海,汽车1+2（勤易汽车服务中心）,15601907875,青浦区淀浦河东路61号,06:00-18:00
上海市,上海,御臨君（藤原汽车服务）,18717747060,松江区桃源路62号,09:00-18:00
上海市,上海,昼创汽车技术服务中心,15555066555,松江区车墩镇南姚路100号,08:00-20:00
上海市,上海,顺达汽车装潢美容（青湖路店）,02159718003,青浦区青湖路1150弄16号,08:00-18:00
上海市,上海,车博士名车汽车养护中心,17701428866,奉贤区南桥路537号,09:00-18:00
上海市,上海,上海湃赛汽车服务有限公司,13524263830,松江区车泾路123号,08:00-19:00
上海市,上海,驰加（上海石天贸易有限公司）,02157417019,奉贤区南桥镇沪杭公路1787-1791号,07:30-17:30
上海市,上海,统一(任驿汽修),19916758177,青浦区青湖东路855号,08:00-20:00
上海市,上海,嘉实多（上海徐隽汽车服务有限公司）,13764888834,奉贤区南桥镇沪杭公路1793号,09:00-18:00
上海市,上海,京车会（万驰汽车南港路店）,13701830978,奉贤区南港路928号,09:00-18:00
上海市,上海,京东京车会（上海务众汽车装潢）,18049778763,青浦区华科东路188号,09:00-18:00
上海市,上海,中策车空间（上海市闵行区万州旗舰店）,13564460272,闵行区昆阳路864号,08:00-23:00
上海市,上海,新居洗车,13103815841,闵行区罗阳路551号,09:00-18:00
上海市,上海,美孚（上海腾亨汽车服务有限公司）,18016397868,松江区洞泾镇沈砖公路5599号（伟凯工业园）,08:00-18:00
上海市,上海,嘉实多（上海心怡汽车服务）,18918952893,松江区洞宁路612号,08:00-18:00
上海市,上海,中华（华星尊尚汽车服务）,18621758558,青浦区外青松公路5088号,08:00-21:00
上海市,上海,辉腾志标汽车美容,17301630186,青浦区香花桥街道大盈路459号,06:33-20:00
上海市,上海,完美汽车技术服务中心,13641969707,松江区新南街133号,09:00-18:00
上海市,上海,壳牌（完美汽车服务有限公司）,13641969707,松江区新桥镇新南街147弄14-16号,08:00-18:00
上海市,上海,京东京车会（上海斐卓汽修）,18667612166,闵行区华宁路196号,08:30-18:00
上海市,上海,中华（森台华晨服务中心）,13391298696,青浦区赵巷镇赵重公路108号,08:00-20:35
上海市,上海,杰成汽车维修服务,15801989181,闵行区东川路2716号,08:30-19:00
上海市,上海,金富力（浩允汽车服务有限公司）,15221909205,闵行区碧江路355号,08:00-18:00
上海市,上海,车美饰汽车美容装饰,15555551135,青浦区镇中路545号,08:00-19:00
上海市,上海,艾倍力（骋岳汽车服务中心）,02169758000,青浦区镇泽路532号,09:00-18:00
上海市,上海,汽车维修美容,13764320695,闵行区碧江路444号红旗停车场,06:00-18:00
上海市,上海,德宏汽车养护站,13122723705,闵行区景谷中路635号,09:00-17:00
上海市,上海,壳牌（玉雷汽车养护中心）,18521530731,闵行区景谷中路635号,09:00-18:00
上海市,上海,壳牌（上海迢隆汽车服务有限公司）,15921227965,奉贤区西闸公路1100号,09:00-18:00
上海市,上海,韩泰（天宇汽车维修服务部）,18818063617,青浦区赵重公路1741号,08:00-18:00
上海市,上海,邓禄普（上海坤誉贸易有限公司）,15021297756,松江区泗砖路1弄11号,09:00-18:00
上海市,上海,阿包汽修美容,13701629492,闵行区石屏路179号,09:00-18:00
上海市,上海,倍耐力（上海宏吉轮胎有限公司）,02154746998,闵行区德宏路2554-2560号,08:00-18:00
上海市,上海,新华瑞汽车养护中心,18037759810,青浦区沪北青平公路2599号,09:00-18:00
上海市,上海,实田友进汽车维修中心,13301792919,闵行区瓶安路518号,09:00-18:00
上海市,上海,马石油（炫丽汽车养护）,13918195117,青浦区重固镇赵重公路2788弄,08:00-18:00
上海市,上海,固特异（盈港汽车服务中心）,13122123371,青浦区盈港东路佳悦路东100米,09:00-18:00
上海市,上海,大蜂车（银都西路店）,18301983721,松江区银都西路350号歆翱商务园 A3 ,08:20-20:00
上海市,上海,嘉昱汽车服务,15800593229,松江区银都西路350号,09:00-18:00
上海市,上海,欧洲维修（凌度颛桥店）,13122853301,闵行区颛盛路510号,08:00-17:30
上海市,上海,浦宇汽车维修,13585571160,松江区银都西路236号,07:45-19:15
上海市,上海,嘉实多（颛盛汽车维修有限公司）,15021439028,闵行区颛盛路490号,08:10-18:10
上海市,上海,壳牌（上海靓俊汽车服务有限公司）,13818650364,闵行区颛桥镇沪闵路3158号,07:50-18:00
上海市,上海,壳牌（上海市梓淼汽车厂）,02134686385,闵行区沪闵路3131弄243-244号,06:00-18:00
上海市,上海,小拇指（久富路店）,02160514293,松江区九亭镇久富路100号,09:00-18:00
上海市,上海,美孚（上海伟都汽车维修有限公司）,13585613135,闵行区伟都路235号,06:00-18:00
上海市,上海,车车翔（中春路店）,18221207760,闵行区申北路586-588号,08:00-19:00
上海市,上海,车车翔（春光路店）,02133581883,闵行区春光路168号,09:00-18:00
上海市,上海,阿坤汽车维修美容中心,13564742926,青浦区迮庵路277号,08:00-16:30
上海市,上海,永坤汽修厂,15713803623,闵行区都会路2736号,08:30-17:30
上海市,上海,马石油（鑫瑞汽配汽修）,13501665597,青浦区凤星路1695号,09:00-18:00
上海市,上海,马石油（隆鑫汽车专业维修）,15900533035,青浦区凤溪镇凤星路1697号2-3号,08:00-18:00
上海市,上海,高坡轮胎,13764142667,青浦区凤星路1595号,08:00-21:00
上海市,上海,劲锐车坊（虬泾路店）,02157850330,松江区九亭镇虬泾路673-675号,09:00-18:00
上海市,上海,德国马牌（百绩贸易）,16602126222,闵行区颛桥镇贵都路211号,09:00-18:00
上海市,上海,汽车1+2 （鹤祥路店）,18217427525,青浦区鹤祥路354号,09:00-18:00
上海市,上海,上海巢奈汽车服务有限公司,18217666682,青浦区诸陆西路230号,09:00-18:00
上海市,上海,鸿运来汽车服务中心,13564991610,青浦区白鹤镇鹤祥路138号,09:00-18:00
上海市,上海,喜韬汽车服务中心,13601891993,闵行区西环路381号（欣欣停车场内）,09:00-18:00
上海市,上海,启啸汽车服务,13122841521,奉贤区兰博路2776号,09:00-18:00
上海市,上海,金富力（车世界汽车维修）,18721731450,闵行区都会路2769号,07:40-20:00
上海市,上海,梦城汽车服务中心,18712372229,闵行区通海路439号,09:00-18:00
上海市,上海,上海梦城汽车修理厂,13621600575,闵行区通海路285号,06:00-18:00
上海市,上海,BTL汽车俱乐部,15618985936,闵行区曲吴路589号中国梦谷7A,10:00-22:00
上海市,上海,上海冠信汽车服务有限公司,13120978688,闵行区顾戴路3100弄39号,09:00-18:00
上海市,上海,CJ车捷汽车养护中心,15026599156,青浦区西胜路963号,07:30-22:00
上海市,上海,XP汽车美容俱乐部,18221078232,闵行区腾冲路61号,08:00-20:00
上海市,上海,车联万家（东奥汽车维修）,15341192711,闵行区腾冲路59号,09:00-18:00
上海市,上海,上海捷鲨维修有限公司,13681918342,青浦区双联路378号院内（羽毛球馆旁边）,08:00-18:30
上海市,上海,韦尔斯（海林汽车服务中心）,15821134828,闵行区龙吴路5268号（近放鹤路）,06:00-18:00
上海市,上海,奇瑞新能源（如恒汽车）,18217660753,松江区涞亭北路441号,08:00-17:30
上海市,上海,嘉实多（上海翔睿汽车服务）,13311778681,闵行区金都路1450号,08:00-19:00
