江苏省,苏州,远顺汽车服务,13771648711,吴江区金厍路572号,09:00-18:00
江苏省,苏州,大拇指汽车生活馆(西塘河路店),18452766208,吴江区西塘河路19号,08:00-18:00
江苏省,苏州,尊卡汽车维修美容,15051597421,吴中区木渎镇明清街12号,09:00-18:00
江苏省,苏州,车享家（苏州江兴西路店）,051267587284,吴江区松陵镇江兴西路226号,09:00-17:30
江苏省,苏州,韦尔斯润滑油（车爵仕一站式服务）,18012650888,吴江区中山北二路777号,09:00-18:00
江苏省,苏州,埃斯(诚盛汽车服务养护中心),15995898227,吴中区香港街3-1号,09:00-17:00
江苏省,苏州,车享家（苏州香港路店）,051268418750,吴中区木渎镇天平村天灵1组陆家村68号,09:00-17:30
江苏省,苏州,壳牌（美丽车仆汽车）,13328000441,吴江区运东大道937号,07:30-20:00
江苏省,苏州,车享家（苏州越溪街店）,051267683078,吴中区越溪街道香悦花园5幢115/116室,09:00-17:30
江苏省,苏州,翔龙汽修,18752998148,吴江区新传路488号,08:00-20:00
江苏省,苏州,秋名山汽车美容,13862527182,吴江区新传路439号,08:00-18:00
江苏省,苏州,固特异(潇洋汽车服务有限公司),13915500021,吴中区吴山街11-13号,09:00-18:00
江苏省,苏州,鸿达汽车维修,15501612617,虎丘区树园路119号,09:00-18:00
江苏省,苏州,骏逸车业（木渎店）,15062535008,吴中区木渎金山南路47号,09:00-18:00
江苏省,苏州,佳嘉汽车服务,13218109687,虎丘区姚江山路11号,07:00-19:00
江苏省,苏州,道达尔（苏州隆晟汽车维修有限公司）,15995712112,吴中区竹园西路98号,09:00-18:00
江苏省,苏州,新奥车业一站式汽车服务,13375195680,吴中区木渎镇竹园路688号,09:00-18:00
江苏省,苏州,德国马牌（民生汽车维修美容）,13656257162,吴江区227省道4580号,09:00-18:00
江苏省,苏州,新奇特（第二分店）,13862144599,吴中区中山东路166号,09:00-18:00
江苏省,苏州,固特异（海洋轮胎销售有限公司）,18796804909,吴中区竹园路5号,07:30-20:30
江苏省,苏州,顺德汽车一站式服务,18912734997,吴江区迎燕东路101号,09:00-18:00
江苏省,苏州,上海车居(同里店),13306250081,吴江区迎燕东路66号,09:00-18:00
江苏省,苏州,开心汽车（凯马广场店）,15312183852,吴中区中山东路170号,08:30-17:30
江苏省,苏州,秀车一族汽车养护专家,051266910009,虎丘区科技城科创路20号,09:00-18:00
江苏省,苏州,龙捷快修（影视城店）,0512-66571555,吴中区金山南路288号,09:00-18:00
江苏省,苏州,枫华汽车养护,17625659235,吴中区枫华商业广场3幢,07:30-23:00
江苏省,苏州,新奇特车业（竹园路店）,051266299333,吴中区竹园路128号,09:00-18:00
江苏省,苏州,苏城车友汽车俱乐部,18550097938,吴中区珠江路159号,08:20-17:00
江苏省,苏州,德正隆汽车服务有限公司,13771835912,吴中区珠江中路159号,09:00-18:00
江苏省,苏州,车美丽汽车生活馆,18796431113,虎丘区梦之城3层,07:18-19:18
江苏省,苏州,志恒汽车维修部,18094258409,吴中区枫瑞路178号,06:00-22:00
江苏省,苏州,苏州犀友车业,15250429420,吴中区长江路9号长江壹号生活广场负一层,08:00-19:00
江苏省,苏州,车居仕汽车美容装潢,18914070770,吴江区中山北路2608号,09:00-18:00
江苏省,苏州,斯创汽车技术服务(吴中店）,18962194026,吴中区观音山路369号,08:00-19:00
江苏省,苏州,公里速（新区店）,13115162800,虎丘区紫金街36号,08:00-18:00
江苏省,苏州,锦湖轮胎(泰洁汽修),15051788377,吴中区蠡昂路274号,08:00-19:00
江苏省,苏州,普利司通（鸿玉汽车配件经营部）,15895525491,吴江区屯村大道59号,09:00-18:00
江苏省,苏州,米其林（友客汽修）,18118159583,吴江区屯村东路加油站对面,09:00-18:00
江苏省,苏州,苏奥汽车维修,15962117768,吴江区清扬路迎春华府向东1000米,09:00-18:00
江苏省,苏州,嘉实多(酷锐汽车服务部),18606252188,虎丘区迎宾路16号,09:00-18:00
江苏省,苏州,奥驰汽车快修养护中心,13776140214,吴江区屯村东路533号,09:00-18:00
江苏省,苏州,加德士(恩典汽车维修中心),13222281549,吴中区兴南路19号,09:00-18:00
江苏省,苏州,车享家（苏州苏蠡路店）,051267079312,吴中区苏蠡路36号,09:00-17:30
江苏省,苏州,旭瑞车业,15850221722,吴中区枫津南路22号2幢,09:00-18:00
江苏省,苏州,新奇特一站式汽车养护中心,0512-82283580,吴中区枫津南路22号3幢,09:00-18:00
江苏省,苏州,1999汽车美容装潢,13585361996,吴江区屯村东路358号,07:00-20:00
江苏省,苏州,车享家（苏州世贸运河城店）,051262380108,姑苏区宝带西路1199号1幢101-103室,09:00-17:30
江苏省,苏州,邓禄普（海超汽车）,18912608477,姑苏区太湖西路1188号,09:00-18:00
江苏省,苏州,车逸家汽车维修养护中心,15950081777,吴中区东吴南路1幢122号,09:00-18:00
江苏省,苏州,永翔一站式汽车服务,17388087189,吴中区东吴南路125号,09:00-18:00
江苏省,苏州,龙捷快修（狮山店）,0512-66571500,虎丘区金山路78号,09:00-19:00
江苏省,苏州,壳牌（鑫升祥车业）,18012733338,吴中区天灵路200号1幢,06:00-19:00
江苏省,苏州,车艺族一站式汽车服务连锁,18912797802,虎丘区玉山路80号,09:00-18:00
江苏省,苏州,固特异(航盛一站式服务连锁),13382186988,虎丘区滨河路558号,09:00-18:00
江苏省,苏州,三道汽车连锁（吴中店）,15506131773,吴中区东吴南路155-6号,08:00-18:00
江苏省,苏州,壳牌（万佳汽配汽修）,13862102227,吴中区枫津路99号,08:10-19:30
江苏省,苏州,苏州胜宝汽修一站式服务中心,13013897696,吴中区天灵路25号25-4,08:00-20:30
江苏省,苏州,壹车仆汽车服务,15262471650,吴中区花园街40号,09:00-18:00
江苏省,苏州,苏州骏诚车业,18206206939,姑苏区友新路1188号,08:30-18:30
江苏省,苏州,锦宏汽修,13732632707,姑苏区解放西路91号,08:30-18:00
江苏省,苏州,烈马骑士汽车养护专家,13739170812,虎丘区长江路511号,08:00-17:30
江苏省,苏州,倍耐力(嘉腾车业),18913128107,吴中区龙西路98号,08:00-17:30
江苏省,苏州,车享家（苏州云庭路店）,051268225362,姑苏区云庭路3-4-5号,09:00-17:30
江苏省,苏州,正新轮胎（新友汽车服务）,18915553222,姑苏区友新路友联二村85幢104座,08:00-18:00
江苏省,苏州,越顺汽车维修服务部,13771814427,吴中区宝带西路282号,09:00-18:00
江苏省,苏州,嘉实多(阿香车一站式汽车服务),13338691453,虎丘区金山路3号,08:30-18:00
江苏省,苏州,车洗家,15295673802,吴中区吴中商城白云街4-3号,07:30-19:30
江苏省,苏州,爱客汽车服务连锁（吴中店）,18913521260,吴中区水香街190号,09:00-18:00
江苏省,苏州,新奇特汽车服务（盘蠡路店）,051282283569,吴中区盘蠡路水香六村19幢,09:00-18:00
江苏省,苏州,骏逸一站式汽车服务（精维店）,18118110810,姑苏区桐泾南路311号,07:40-18:00
江苏省,苏州,韩泰轮胎（康隆汽车维修服务部）,13862575358,姑苏区南环西路651号,09:00-17:30
江苏省,苏州,米其林轮胎（竞驰汽车服务有限公司）,15850214158,吴中区尹中路66号商铺1-103号,08:15-17:30
江苏省,苏州,雅德车业一站式服务站,13013792965,吴中区郭新西路蔡家浜3号,09:00-18:00
江苏省,苏州,车享家（苏州长江路店）,051265368875,虎丘区长江路612号,09:00-17:30
江苏省,苏州,道达尔(车迪仕汽车服务中心),18013566739,吴中区郭巷镇彩虹路37号,09:00-18:00
江苏省,苏州,仙奇车业,17712631582,吴中区郭巷彩虹路43号,06:30-21:30
江苏省,苏州,酷优汽车维修保养美容装潢,15365312700,吴中区彩虹路10号,09:00-18:00
江苏省,苏州,夏园汽车一站式服务（姜庄店）,18001547372,吴中区谷盛路2号,09:00-18:00
江苏省,苏州,车马驿站汽车服务,18662268617,吴中区文曲路203号,08:00-18:00
江苏省,苏州,壳牌（养车堂一站式服务中心）,13625284172,吴中区文曲路280号,07:30-18:30
江苏省,苏州,乐驾汽车服务有限公司,18118162889,吴中区文曲路232号,07:00-20:00
江苏省,苏州,富鑫汽车一站式服务,15306139566,吴中区吴中东路118号,09:00-18:00
江苏省,苏州,车享家（苏州吴中东路店）,051267074359,吴中区吴中东路119-5号,09:00-17:30
江苏省,苏州,姑苏区宏诚汽车维修,13913149888,姑苏区胥江路179号,08:00-18:58
江苏省,苏州,APEX(豪门汽车会所),13915503757,吴中区迎春路174号,09:00-18:00
江苏省,苏州,加德士（苏援汽车维修有限公司）,18962526173,姑苏区枫桥路688号,08:10-18:00
江苏省,苏州,佳良汽车用品,18012616299,姑苏区西园路767号闻钟苑12幢,09:00-18:00
江苏省,苏州,美孚（威杰汽车服务有限公司）,051265831769,姑苏区金门路小商品市场出口处,08:00-18:00
江苏省,苏州,车享家（苏州南环东路店）,051268556965,姑苏区南环东路869-875号,09:00-17:30
江苏省,苏州,盛唐汽修美容,13776040053,姑苏区南环大街279号正南方向70米,08:00-21:30
江苏省,苏州,苏州锦安汽车一站式服务中心,13405055222,虎丘区运新路15号（鸿基科技园东北门）,08:00-19:00
江苏省,苏州,众驰汽修,15250049149,吴中区纬二路综合保税区A楼背面,09:00-18:00
江苏省,苏州,李健汽车快修,15190069722,虎丘区兴贤路611号,08:00-18:00
江苏省,苏州,车艺骏汽车服务,18260116202,姑苏区锦南巷77号（姑苏生鲜南环市场B1层 ）,08:00-18:30
江苏省,苏州,胜牌（志远汽车维修服务）,18994433377,吴中区尹东农贸市场内,08:00-18:00
江苏省,苏州,马上汽车（南门路店）,15850129291,姑苏区南门路851号,08:30-20:30
江苏省,苏州,宝利金汽车有限公司,15250073550,虎丘区鸿福路洪福花苑2-5号,08:30-17:00
江苏省,苏州,标龙汽修（新区店）,17371532878,虎丘区长江路858号,08:00-17:30
江苏省,苏州,豪特汽车服务,18120069302,吴中区松江大道加油站,09:00-18:00
江苏省,苏州,加德士（赣商阳阳汽车服务）,18913159818,姑苏区西环路3108号,07:30-19:00
江苏省,苏州,美仕途汽车生活馆,17729955551,姑苏区虎阜路999号虎丘婚纱B区负1楼b3入口,09:00-18:00
江苏省,苏州,维车仕车业,13862053967,吴中区叠翠峰东门1幢101室,08:00-18:30
江苏省,苏州,三道汽车,18912621921,吴中区东兴路118号星叶广场负一楼,08:00-18:00
江苏省,苏州,有车一族汽车美容装潢店,18915505682,姑苏区南园北路6号,09:00-18:00
江苏省,苏州,龙捷快修(浒关店),18136177100,虎丘区文昌路天玺街负一层,09:00-18:00
江苏省,苏州,80车盟,13915578827,苏州工业园区东方大道双银国际金融城4-1238,08:00-17:30
江苏省,苏州,车享家（苏州东兴路店）,051265152595,苏州工业园区东兴路38号,09:00-17:30
江苏省,苏州,神彩汽车养护中心,15806216013,姑苏区杨枝塘路102号,07:30-18:30
江苏省,苏州,夏园汽车一站式服务（湖岸名家店）,18913606652,苏州工业园区通达路1875-1号,08:00-18:00
江苏省,苏州,宝雪龙汽业,18662172355,苏州工业园区通园路228号,08:00-17:30
江苏省,苏州,邓禄普（靓途批发零售店）,18994313449,相城区迎湖路8号,09:00-18:00
江苏省,苏州,玛吉斯（靓途车业）,18994313449,相城区迎湖路2号,08:15-16:50
江苏省,苏州,龙捷快修（广济店）,13771684881,姑苏区钱万里桥公交首末站,08:00-17:00
江苏省,苏州,鑫宏汽车一站式服务（旗舰店）,13073362262,相城区问渡路12号,09:00-18:00
江苏省,苏州,宝雪龙汽车维修服务公司,18651113836,姑苏区葑门路10号,09:00-18:00
江苏省,苏州,车驿堂汽车,18061937880,吴中区万科美好广场负一层,10:00-18:00
江苏省,苏州,车享家（苏州平泷路店）,051267529370,姑苏区平泷路1258号105室,09:00-17:30
江苏省,苏州,加德士（捷驰汽车维修服务）,13013812568,姑苏区平川路锦芳街苏锦一村小区大门口,08:00-18:00
江苏省,苏州,苏州车易润,18362724516,姑苏区平齐路平齐花苑14幢107室,08:00-17:00
江苏省,苏州,马上汽车（贵都服务店）,15250933922,吴中区贵都邻里中心天天向上斜对面,09:00-17:30
江苏省,苏州,美孚（星程汽车美容装潢）,15962256163,姑苏区锦荷街103号,09:00-18:00
江苏省,苏州,长城一站式汽车服务中心,15952403181,苏州工业园区工业技术学校东门,09:00-18:00
江苏省,苏州,森诚汽车维修服务中心,15250062929,姑苏区齐门外大街313号,08:10-18:30
江苏省,苏州,荣昌行车业,18651111456,姑苏区东环路1858号7幢101室,08:00-19:00
江苏省,苏州,爱客汽车服务连锁（独墅湖店）,0512-66986900,苏州工业园区工业园区若水路1号,08:00-18:00
江苏省,苏州,骏逸车业（园区卡马仕店）,18151092525,苏州工业园区苏慕路117号（湖西派出所旁）,09:00-18:00
江苏省,苏州,壳牌(苏州万福源汽车服务有限公司),15150451577,吴中区娄门路86号,08:00-20:00
江苏省,苏州,美车饰汽车一站式服务中心,18118120013,吴中区苏虹西路百合街10号,07:30-18:30
江苏省,苏州,龙捷汽修(繁花店),15950068460,相城区澄湖西路964号繁花中心地下负二楼,09:00-21:00
江苏省,苏州,玛吉斯（金超汽车一站式服务）,13451569032,相城区台上路30号,09:00-18:00
江苏省,苏州,中晟车业（相城店）,18606209696,相城区黄桥镇永旺家园东100米,08:00-18:00
江苏省,苏州,嘉实多（馨车航汽车服务部）,15062344305,相城区善济路107号合景峰汇3期,07:00-20:59
江苏省,苏州,车享家（苏州人民路店）,051265866996,相城区人民路与聚贤路交汇处峰汇商务广场3幢124室一层,09:00-17:30
江苏省,苏州,车享家（苏州星湖街店）,051262981961,苏州工业园区星湖街1260-1262号,09:00-17:30
江苏省,苏州,迪奥迪美汽车修理有限公司,15051401855,相城区春申湖西路901号,09:00-18:00
江苏省,苏州,苏州车无忧,15699998849,相城区沈思港路95号,08:00-18:00
江苏省,苏州,苏州车侣汽车服务有限公司,13402699183,相城区荷馨街95号,07:30-18:00
江苏省,苏州,龙捷快修（相城店）,13625270994,相城区齐门北大街71号,08:00-17:00
江苏省,苏州,韦尔斯(名车之旅),13004515468,相城区长旺路97号,09:00-18:00
江苏省,苏州,航盛车业一站式汽车服务连锁,0512-62511555,苏州工业园区东福路45号,09:00-18:00
江苏省,苏州,车之佳汽车养护,13913586520,相城区阳澄湖中路68号,09:00-18:00
江苏省,苏州,车子佳汽车连锁,13701410469,相城区兴旺路1号,09:00-18:00
江苏省,苏州,加德士（车之杰汽车会所）,15250027413,相城区苏隶方浜加油站向南30米,08:00-18:30
江苏省,苏州,兴塘豪华车专修连锁（园区店）,13862182555,苏州工业园区民生路28号,08:00-18:00
江苏省,苏州,固特异（兰博仕汽车维修）,0512-69573320,相城区齐门北大街1490号,09:00-18:00
江苏省,苏州,德国马牌（鸿德汽车维修）,13915568409,相城区齐门北大街嘉和丽园22幢109号,09:00-18:00
江苏省,苏州,佳诚汽车服务中心,15050409111,相城区元和街道聚元街475号,07:00-19:30
江苏省,苏州,捷美汽车美容,18261894006,相城区齐门北大街1578号,09:00-18:00
江苏省,苏州,朋城汽修,18118449166,苏州工业园区孟下村笛普智慧智慧园,09:00-18:00
江苏省,苏州,名华汽车一站式服务中心,18550086238,相城区齐门北大街1598号,07:30-19:00
江苏省,苏州,方阳汽车美容,13405001123,相城区嘉元路588号,07:00-21:00
江苏省,苏州,道得尔（传胜汽车会所）,15950041757,相城区春申湖中路283号,09:00-18:00
江苏省,苏州,一番车道（苏虹中路店）,18621378956,苏州工业园区苏虹中路399号,09:00-18:00
江苏省,苏州,城市车族汽车服务,18626216046,相城区澄和国际服装城A区12号楼171室,09:00-18:00
江苏省,苏州,爱客汽车服务连锁(苏虹路店),051262583303,苏州工业园区苏虹中路399号7幢1号单元,09:00-18:00
江苏省,苏州,宝骏行汽车一站式服务,15250115333,相城区书香路71号,09:00-18:00
江苏省,苏州,宝车仕汽车一站式服务,17625586208,相城区书香路9号,05:00-20:00
江苏省,苏州,车利捷（相城店）,18915556918,相城区华元路99号,07:40-17:30
江苏省,苏州,潮车族汽车美容装饰,13291178757,相城区徐阳路138号,09:00-18:00
江苏省,苏州,公里速（相城店）,15850129620,相城区御窑路与苏虞张公路交叉口东150米,09:00-18:00
江苏省,苏州,后浪汽车服务,18962111418,吴中区唯亭葑亭大道678号4号厂房,09:00-18:00
江苏省,苏州,轟众车业一站式汽车服务中心,15250114558,相城区澄云路31号,08:00-17:00
江苏省,苏州,华胜车业连锁（园区店）,13814497940,吴中区苏虹中路45号,08:30-17:00
江苏省,苏州,龙捷汽修（广前店）,17751294225,相城区广前路11号广济医院地下停车负一楼,08:30-17:00
江苏省,苏州,正新轮胎(甪直正新汽车维修部),18506217832,吴中区甪直镇甫澄北路12号甫澄熙岸二期西门,07:30-19:00
江苏省,苏州,车享家（苏州亭盛街店）,051265914553,苏州工业园区亭盛街65幢101-103号,09:00-17:30
江苏省,苏州,清风车业维修保养中心,15262411197,苏州工业园区胜浦瑞祥商业广场2栋133-135室,08:00-17:30
江苏省,苏州,爱车逸族,18115512325,吴中区星龙街298号,07:30-19:00
江苏省,苏州,美孚（甪捷汽车维修）,13584888145,吴中区甪直镇育才路1号,09:00-18:00
江苏省,苏州,乐语汽车修理厂,18862337020,苏州工业园区唯新路7号,08:30-17:31
江苏省,苏州,渡客车业,13913501787,苏州工业园区葑亭大道355号,08:00-17:30
江苏省,苏州,苏皖汽车养护,15995831792,苏州工业园区金陵西路商业街2期,07:00-19:00
江苏省,苏州,矫马(金扳手漕湖维修中心),18550208029,相城区漕湖商业广场4-108号,08:30-17:00
江苏省,苏州,和信行名车养护连锁,13962148692,吴中区唯亭后戴街9号苏州时尚舞台品牌城F1,08:30-17:00
江苏省,苏州,龙捷快修（漕湖店）,0512-65720981,相城区观塘路漕湖邻里中心1楼F144号（西南角）,09:00-18:00
江苏省,苏州,米其林（志诚乐乐汽车一站式服务）,0512-67591767,相城区兴太路22号,08:30-19:00
江苏省,苏州,正新轮胎(顺佳轮胎有限公司),13815258572,苏州工业园区金陵东路338号,09:00-18:00
江苏省,苏州,车享家（苏州太东路店）,051265448950,相城区太平街道太东路2号7-103-105,09:00-17:30
江苏省,苏州,途凯汽车维修服务部,13270997539,相城区金澄路金澄新天地16幢,07:00-19:00
江苏省,苏州,车缘点（太平店）,18020597877,相城区太平金澄广场9幢30号,08:00-18:00
江苏省,苏州,车易好汽车维修股份有限公司,18662271958,相城区河东路2-12号,08:10-18:00
江苏省,苏州,壳牌（名骏百盛一站式服务）,15295678889,相城区苏渭路（云泉浴场院内）,09:00-18:00
江苏省,苏州,路航（车居士汽车服务中心）,17857252655,相城区太平镇富升路3号,08:00-17:00
江苏省,苏州,长城(东升汽车一站式服务),13222208297,相城区太平街道兴太路228号,09:00-18:00
江苏省,苏州,领航（爱华汽修厂),18962008807,相城区珍珠湖路6号,07:30-18:30
江苏省,苏州,车艺匠汽修,13776045214,相城区珍珠湖路12号,08:00-18:00
江苏省,苏州,车享家（苏州澄阳路店）,051266834647,相城区渭塘镇澄阳路2588号110室,09:00-17:30
江苏省,苏州,御祥一站式汽车服务,15190152375,昆山市千灯镇南浦东路508号,08:00-20:00
江苏省,苏州,路欧峰（豫北汽车用品店）,15001877862,昆山市炎东路5号,06:30-23:59
江苏省,苏州,车享家（苏州昆山人和路店）,051250151998,昆山市千灯镇人和路225-229号,09:00-17:30
江苏省,苏州,车帝一站式汽车服务,18118173444,昆山市南浦东路154号,09:00-18:00
江苏省,苏州,豪车码头汽车服务中心,18662355269,昆山市名人华城33栋27号,07:30-20:00
江苏省,苏州,帝车会汽车服务中心,15050217638,昆山市千灯镇少卿西路510号,07:00-16:30
江苏省,苏州,玛吉斯（博众汽车美容维修）,18013287746,昆山市南湾路836号,09:00-18:00
江苏省,苏州,嘉实多(小岳汽车服务中心),13218174256,相城区凤北公路与相城大道交叉口北100米,09:00-18:00
江苏省,苏州,车厘子理车（千灯店）,15250200155,昆山市千灯镇少卿路3号3幢,08:00-19:00
江苏省,苏州,普利司通（千灯店）,13584958084,昆山市秦峰花园32号,09:00-18:00
江苏省,苏州,轟众车业（阳澄湖店）,18015655755,相城区凤阳路318号,08:00-17:30
江苏省,苏州,车俊翔汽车美容服务中心,18255679918,昆山市巴城镇通澄向日葵花园81号楼103商铺,07:30-21:00
江苏省,苏州,车享家（苏州昆山前进西路店）,051236910121,昆山市巴城镇通澄花园四期81幢101号,09:00-17:30
江苏省,苏州,壳牌（天使爱车一站式服务）,15895651431,昆山市明澄路257号,07:30-18:30
江苏省,苏州,安耐普养护快修服务中心,18862173918,昆山市巴城镇金澄路279号,09:00-18:00
江苏省,苏州,苏州正车堂汽车服务有限公司,13771935130,相城区凤阳路163号,09:00-18:00
江苏省,苏州,嘉实多（艺车堂一站式汽车服务）,13771892090,相城区凤阳路159号,08:00-18:00
江苏省,苏州,艾姆肯汽车美容养护中心,13063751126,昆山市中华园西路183号,08:00-19:00
江苏省,苏州,美孚（车品会汽车服务中心）,13912657663,昆山市创业路588号,07:30-18:30
江苏省,苏州,欧德耐汽车生活馆,18917577781,昆山市衡山路288号,08:00-19:00
江苏省,苏州,德骏行,13806268244,昆山市城西民新路1号,08:00-18:00
江苏省,苏州,迪奥车业,18662516555,常熟市辛庄新阳大道65-1号,09:00-18:00
江苏省,苏州,壳牌（车之隆一站式服务中心）,15150468225,昆山市合兴西路189号,07:20-19:00
江苏省,苏州,汽车e族一站式服务,13218175993,常熟市新阳大道57号,09:00-18:00
江苏省,苏州,昆山树德汽车用品有限公司,18912689788,昆山市陆家镇陆丰西路88号建伟国际汽车城7幢24号,08:00-18:00
江苏省,苏州,正新（车友之家轮胎服务中心）,15366275602,昆山市联谊路251号,07:31-17:00
江苏省,苏州,MOTUL(小赵汽车服务),18012661250,昆山市鹿城路605号,09:00-18:00
江苏省,苏州,玛吉斯（晟通车业）,18662549801,昆山市友谊东路001号,09:00-18:00
江苏省,苏州,韩泰轮胎（清风车影）,15151669178,昆山市玉山镇鹿城路750-756号,09:00-18:00
江苏省,苏州,卡诺嘉（爱车一族）,17372615250,昆山市长江南路1164号,08:00-18:00
江苏省,苏州,车享家（苏州昆山庆丰东路店）,051250161686,昆山市庆丰东路345-351号,09:00-17:30
江苏省,苏州,美孚（程森汽车维修服务中心）,18702101455,昆山市香榭丽大道718弄1号11室,08:00-20:00
江苏省,苏州,美车有道,13764130773,昆山市春天大道258号20室,07:40-21:00
江苏省,苏州,驿站汽车服务部（花园路店）,17712471773,昆山市花园路1915号,09:00-18:00
江苏省,苏州,车之邦一站式汽车服务中心,18602159462,昆山市花园路1731号,08:00-18:30
江苏省,苏州,德国马牌（联浩轮胎商行）,15006267849,昆山市巷浦路1号,09:00-18:00
江苏省,苏州,苏雄汽车服务部,18626248753,昆山市景王路33号,08:00-19:00
江苏省,苏州,道得尔（艺荣车臣汽车养护中心）,15921780163,昆山市商银路1255号,08:00-20:00
江苏省,苏州,车艺驰车体极致护理,15155761823,昆山市花桥镇绿地大道双联国际1幢,08:00-20:00
江苏省,苏州,牛牛车坊,15221616818,昆山市商银路1255号6栋001（双联国际商务中心）,08:00-22:00
江苏省,苏州,亿车汇汽车,17501429325,昆山市玉山镇昆太路686号,07:00-19:00
江苏省,苏州,舒车堂汽车服务连锁,18118176295,昆山市富士康路1183号,09:00-18:00
江苏省,苏州,车厘子理车,17712473607,昆山市前进东路1008号,07:30-18:00
江苏省,苏州,卡尔汽车一站式服务,15162629727,昆山市梧桐广场芦北路562号,09:00-18:00
江苏省,苏州,车感觉汽车维修养护,19951267427,昆山市花安路430号,08:00-18:00
江苏省,苏州,懂车帝汽车保养维修中心,13245057777,昆山市横泾路与昆太路交叉口,08:00-18:00
江苏省,苏州,车享家（苏州昆山同丰东路店）,051257719287,昆山市同丰东路1091-1093号,09:00-17:30
江苏省,苏州,车享家（苏州昆山春晖路店）,051236691320,昆山市周市镇春晖路611号一层部分商铺、613号一层部分商铺,09:00-17:30
江苏省,苏州,德国马牌（百事德）,18936114249,昆山市紫竹路1239号,07:30-18:30
江苏省,苏州,昆山鸿隆汽车服务有限公司,13052889488,昆山市昆嘉路341号,08:20-18:00
江苏省,苏州,车享家（苏州昆山金浦路店）,051257995286,昆山市周市镇金浦路344号,09:00-17:30
江苏省,苏州,米其林（安通轮胎）,15906516973,昆山市青阳北路168号,08:00-18:00
江苏省,苏州,尚美汽车一站式服务,15162679275,昆山市白塔路黄金海岸西门,09:00-18:00
江苏省,苏州,洁美汽车养护中心,15298832699,常熟市东升路33号,05:00-23:00
江苏省,苏州,百隆汽车服务连锁(玫瑰湾店),18626096537,昆山市杨树路495号吉玛特生活超市地下一层,09:00-18:00
江苏省,苏州,宝捷龙车业,17312670655,昆山市萧林东路1258号,08:00-18:30
江苏省,苏州,壳牌（广顺汽车服务部）,13773020377,常熟市练塘大道16号,07:00-20:00
江苏省,苏州,美孚（明车坊汽车服务中心）,18351680797,昆山市蓬溪中路27号,00:00-19:00
江苏省,苏州,玛吉斯（天文路店）,13817469661,昆山市天文路20号,07:00-17:00
