江苏省,苏州,兴隆汽车美容装潢,18913075178,吴江区桃花源大道1076号,09:30-16:30
江苏省,苏州,福祥汽车服务中心,13621577622,吴江区华盛大道326号,07:30-17:30
江苏省,苏州,汽车之家（浔青路店）,15995570215,吴江区浔青路99号,08:00-23:59
江苏省,苏州,爱车族汽车护理养护中心,13913720300,吴江区迎春路3号,08:00-17:00
江苏省,苏州,清风汽车美容装潢,18537716688,吴江区吴越北路6038号,07:00-20:00
江苏省,苏州,德林特（胡万里汽车）,13912735866,吴江区望湖路1577号,07:51-17:30
江苏省,苏州,腾达汽车养护,18112723883,吴江区建中路26号,09:00-18:00
江苏省,苏州,超可依汽车养护中心,18721613221,吴江区頴塘路2470号,07:00-21:00
江苏省,苏州,英领汽车维修服务中心,15150296756,吴江区西二环路761号,08:30-17:30
江苏省,苏州,惠忠汽车养护中心,13951123970,吴江区庙震路642号,08:00-17:00
江苏省,苏州,镇夏洗车场,15050159661,吴中区梅园路镇夏华润超市对面,08:00-17:00
江苏省,苏州,苏州车滋润汽车服务中心,18551185920,吴江区天鸿国际家园15-101室,08:00-17:30
江苏省,苏州,隆昌汽车,13222260868,吴江区南环路1700号,09:00-18:00
江苏省,苏州,财神驾道（舜新南路店）,13862142206,吴江区舜新南路1008号,08:00-18:00
江苏省,苏州,德国马牌(金庭中远汽车修配厂),13358005018,吴中区金庭路75号,07:30-17:00
江苏省,苏州,优科豪马(车之侣汽车修理),18912642230,吴中区洞庭路16号,08:00-17:00
江苏省,苏州,车之恋汽车服务中心（梅堰店）,13913708267,吴江区梅龙路10号,08:00-17:30
江苏省,苏州,友谊汽车养护,18662110828,吴江区晨莺路13号,08:00-18:00
江苏省,苏州,和顺汽修,15050393039,吴江区平运路15号,09:00-18:00
江苏省,苏州,艾姆肯汽车（莺湖路店）,13141876931,吴江区吴江平望镇莺湖路96号（金沙碧浪对面）,09:00-18:00
江苏省,苏州,车杰艺汽车一站式服务,15850038976,吴中区木东路8329号,07:30-17:00
江苏省,苏州,美之瑞养车馆,17775007892,吴中区环镇路西100米,08:00-17:00
江苏省,苏州,张亮汽车维修部,13776145866,吴江区黎里镇汤角集宿区卫生服务站右侧,09:00-18:00
江苏省,苏州,苏州杰尔盛汽车服务有限公司,18915588657,吴中区木东路6018号,08:00-17:00
江苏省,苏州,车饰美汽车装潢美容,13585985912,吴江区中山南路上亿国际汽车城19栋113—116号,08:30-18:00
江苏省,苏州,车玛珂汽车养护中心,18914098748,吴中区横泾街道嘉盛花园1幢101室,07:00-17:00
江苏省,苏州,嘉实多(苏州车壹元汽车服务有限公司),15150205888,吴中区木东路7525号,08:00-17:30
江苏省,苏州,美瑞阁汽车一站式服务,18351636260,吴中区东山大道8号,08:00-17:00
江苏省,苏州,领威（车朋轩汽车美容养护）,13349099556,吴江区庞杨路城南花苑1519号,07:30-19:30
江苏省,苏州,万车港汽修,15591302050,吴江区芦荡路1号,08:00-17:30
江苏省,苏州,宝盛汽车服务有限公司,18913595705,吴中区胥口吉祥路207号,07:00-20:00
江苏省,苏州,新焦点修理厂,18662210073,吴中区胥口茅蓬路968号,08:00-17:00
江苏省,苏州,车享家（苏州花园路店）,051263986831,吴江区松陵镇花园路1832-1836号,09:00-17:30
江苏省,苏州,德国马牌（壹车仆汽车服务连锁）,13913115525,吴中区孙武路601号西南方向70米,08:00-18:00
江苏省,苏州,车洁饰汽车美容会所,13906132506,吴江区笠泽路935号,09:00-18:00
江苏省,苏州,苏州旺山汽修,18651115751,吴中区旺山村路与生态路交叉口东150米,09:00-17:00
江苏省,苏州,APEX（知车坊）,13913715850,吴江区文苑路88号（东恒盛酒店停车场）,08:00-17:30
江苏省,苏州,爱马社汽修,18913509376,虎丘区西华路338号,08:00-18:00
江苏省,苏州,苏旺汽修,15956612881,吴中区旺山村路北150米,08:00-17:00
江苏省,苏州,格灵润滑（以勒车业）,13771685387,吴江区体育路125号,08:00-17:30
江苏省,苏州,爱车驿馆一站式服务中心,15162382120,吴江区交通南路2351号,07:50-19:00
江苏省,苏州,吴江一一汽车维修服务站,13912737373,吴江区临沪东路475号,08:00-17:30
江苏省,苏州,祥瑞汽修（锦安小区）,17712675508,吴江区永康路与锦业路交叉口,08:00-20:00
江苏省,苏州,优科豪马轮胎（浩锦汽车服务）,13732646941,吴中区藏书穹灵路2483号,08:00-17:30
江苏省,苏州,锦湖轮胎(腾飞车业),15190097413,吴中区穹灵路2335号,08:00-17:00
江苏省,苏州,车享家（苏州垂虹路店）,051263969635,吴江区松陵镇花园路2318号27,28#,09:00-17:30
江苏省,苏州,苏州美丽基业汽车维修服务有限公司,13814816113,虎丘区绣品街396号,09:00-18:00
江苏省,苏州,捷腾汽车美容,15962577728,吴江区垂虹路173号,09:00-18:00
江苏省,苏州,靓车一族汽车服务,15995555995,吴江区江兴西路862号,09:00-18:00
江苏省,苏州,驰奔行汽车服务,15995610351,吴江区江兴西路860号,08:00-17:00
江苏省,苏州,车享家（苏州梅石路店）,051263986863,吴江区梅石路1629~1631号,09:00-17:30
江苏省,苏州,威狮轮胎(车福鑫汽车配件店）,13451526634,吴中区姑苏西路129号,08:00-17:00
江苏省,苏州,车亿友一站式汽修,18962119026,吴中区方家桥小区107号,08:00-17:00
江苏省,苏州,苏州梦园汽车维修服务有限公司,18762892248,吴中区孙武路54号,08:00-17:00
江苏省,苏州,舒车堂汽车养护会所,18626157836,吴中区姑苏西路11号,08:00-17:00
江苏省,苏州,汾湖汽车维护有限公司,13004568822,吴江区金厍路238号,08:00-17:00
江苏省,苏州,百汇汽车美容部,18762945650,吴江区江兴西路563号,09:00-18:00
江苏省,苏州,壳牌（明达汽修）,13914058062,吴中区庄马路58号,08:00-17:00
江苏省,苏州,普利司通（于淼轮胎配件有限公司）,13855764248,吴中区庄马路341号,08:00-17:00
江苏省,苏州,小马汽修美容中心,17768012935,吴中区庄马路373号,08:00-17:00
江苏省,苏州,君利来汽车服务有限公司,15950078609,吴中区庄马路287号,08:00-17:00
江苏省,苏州,嘉实多(德奥行汽车一站式服务),13915532334,吴中区庄马路291号,08:00-18:00
江苏省,苏州,玛吉斯轮胎汽车一站式服务,15150144781,吴中区庄马路88号,08:00-17:00
江苏省,苏州,车之居汽车1站式服务,15262519777,吴江区江兴西路400号,08:30-17:30
江苏省,苏州,至达美汽车,15051726798,吴江区运东农贸外22号,08:00-20:00
江苏省,苏州,远顺汽车服务,13771648711,吴江区金厍路572号,09:00-18:00
江苏省,苏州,大拇指汽车生活馆(西塘河路店),18452766208,吴江区西塘河路19号,08:00-18:00
江苏省,苏州,尊卡汽车维修美容,15051597421,吴中区木渎镇明清街12号,08:00-17:00
江苏省,苏州,韦尔斯润滑油（车爵仕一站式服务）,18012650888,吴江区中山北二路777号,09:00-18:00
江苏省,苏州,埃斯(诚盛汽车服务养护中心),15995898227,吴中区香港街3-1号,09:00-17:00
江苏省,苏州,车享家（苏州香港路店）,051268418750,吴中区木渎镇天平村天灵1组陆家村68号,09:00-17:30
江苏省,苏州,壳牌（美丽车仆汽车）,13328000441,吴江区运东大道937号,07:30-20:00
江苏省,苏州,杰维行汽车服务,18550901435,虎丘区东渚镇美田里路2号2幢110室,08:00-18:00
江苏省,苏州,翔龙汽修,18752998148,吴江区新传路488号,08:00-20:00
江苏省,苏州,秋名山汽车美容,13862527182,吴江区新传路439号,08:00-18:00
江苏省,苏州,SMC汽车美容改装,15800782120,吴中区木渎镇梅林路71号宏锋产业园内50米左拐,08:30-18:30
江苏省,苏州,固特异(潇洋汽车服务有限公司),13915500021,吴中区吴山街11-13号,08:00-17:00
江苏省,苏州,鸿达汽车维修,15501612617,虎丘区树园路119号,09:00-18:00
江苏省,苏州,骏逸车业（木渎店）,15062535008,吴中区木渎金山南路47号,09:00-18:00
江苏省,苏州,道达尔（苏州隆晟汽车维修有限公司）,15995712112,吴中区竹园西路98号,08:00-17:00
江苏省,苏州,新奥车业一站式汽车服务,13375195680,吴中区木渎镇竹园路688号(金山石雕艺术有限公司旁边),08:00-18:00
江苏省,苏州,德国马牌（民生汽车维修美容）,13656257162,吴江区227省道4580号,08:00-17:00
江苏省,苏州,固特异（海洋轮胎销售有限公司）,18796804909,吴中区竹园路5号,07:30-20:30
江苏省,苏州,顺德汽车一站式服务,18912734997,吴江区迎燕东路101号,09:00-18:00
江苏省,苏州,上海车居(同里店),13306250081,吴江区迎燕东路66号,09:00-18:00
江苏省,苏州,开心汽车（凯马广场店）,15312183852,吴中区中山东路170号,08:30-17:30
江苏省,苏州,秀车一族汽车养护专家,051266910009,虎丘区科技城科创路20号,09:00-18:00
江苏省,苏州,龙捷快修（影视城店）,0512-66571555,吴中区金山南路288号,09:00-18:00
江苏省,苏州,新奇特车业（竹园路店）,051266299333,吴中区竹园路128号,09:00-18:00
江苏省,苏州,苏城车友汽车俱乐部,18550097938,吴中区珠江路159号,08:20-17:00
江苏省,苏州,炫车坊汽车美容装饰(西湖花苑店）,18914028062,吴江区西湖花苑一区1230号,09:00-18:00
江苏省,苏州,澳托猫汽服(沪苏九站店),15821114286,吴中区木渎镇金枫路与竹园路交叉口西侧中石化加油站内（新华路公交站台后面）,08:00-17:00
江苏省,苏州,车美丽汽车生活馆,18796431113,虎丘区梦之城3层,07:18-19:18
江苏省,苏州,志恒汽车维修部,18094258409,吴中区枫瑞路178号,08:00-17:00
江苏省,苏州,苏州犀友车业,15250429420,吴中区长江路9号长江壹号生活广场负一层,08:00-19:00
江苏省,苏州,车居仕汽车美容装潢,18914070770,吴江区中山北路2608号,08:00-17:00
江苏省,苏州,斯创汽车技术服务(吴中店）,18962194026,吴中区观音山路369号,08:00-19:00
江苏省,苏州,苏捷通汽车服务,15106206508,吴中区田上江路185号,08:00-19:00
江苏省,苏州,公里速（新区店）,13115162800,虎丘区紫金街36号,08:00-18:00
江苏省,苏州,锦湖轮胎(泰洁汽修),15051788377,吴中区蠡昂路274号,08:00-18:00
江苏省,苏州,普利司通（鸿玉汽车配件经营部）,15895525491,吴江区屯村大道59号,09:00-18:00
江苏省,苏州,米其林（友客汽修）,18118159583,吴江区屯村东路加油站对面,09:00-18:00
江苏省,苏州,苏奥汽车维修,15962117768,吴江区清扬路迎春华府向东1000米,08:00-17:00
江苏省,苏州,嘉实多(酷锐汽车服务部),18606252188,虎丘区迎宾路16号,09:00-18:00
江苏省,苏州,加德士(恩典汽车维修中心),13222281549,吴中区兴南路19号,08:00-17:00
江苏省,苏州,车享家（苏州苏蠡路店）,051267079312,吴中区苏蠡路36号,09:00-17:30
江苏省,苏州,旭瑞车业,15850221722,吴中区枫津南路22号2幢,09:00-18:00
江苏省,苏州,新奇特一站式汽车养护中心(枫津店),0512-82283580,吴中区枫津南路22号3幢,09:00-18:00
江苏省,苏州,1999汽车美容装潢,13585361996,吴江区屯村东路358号,07:00-20:00
江苏省,苏州,车享家（苏州世贸运河城店）,051262380108,姑苏区宝带西路1199号1幢101-103室,09:00-17:30
江苏省,苏州,邓禄普（海超汽车）,18912608477,姑苏区太湖西路1188号,08:00-17:00
江苏省,苏州,永翔一站式汽车服务,17388087189,吴中区东吴南路125号,08:00-17:00
江苏省,苏州,龙捷快修（狮山店）,0512-66571500,虎丘区金山路78号,09:00-19:00
江苏省,苏州,壳牌（鑫升祥车业）,18012733338,吴中区天灵路200号1幢,08:00-17:00
江苏省,苏州,车艺族一站式汽车服务连锁,18912797802,虎丘区玉山路80号,09:00-18:00
江苏省,苏州,固特异(航盛一站式服务连锁),13382186988,虎丘区滨河路558号,09:00-18:00
江苏省,苏州,三道汽车连锁(吴中店),13812654999,吴中区东吴南路155-6号,08:00-17:00
江苏省,苏州,壳牌（万佳汽配汽修）,13862102227,吴中区枫津路107号,08:30-17:00
江苏省,苏州,苏州胜宝汽修一站式服务中心,13013897696,吴中区天灵路25号25-4,08:00-17:00
江苏省,苏州,壹车仆汽车服务,15262471650,吴中区花园街40号,08:00-17:00
江苏省,苏州,苏州骏诚车业,18206206939,姑苏区友新路1188号,08:30-18:30
江苏省,苏州,锦宏汽修,13732632707,姑苏区解放西路91号,08:30-17:00
江苏省,苏州,龙捷快修连锁（友新路店）,15950068461,姑苏区友新路1188号,09:00-18:00
江苏省,苏州,烈马骑士汽车养护专家,13739170812,虎丘区长江路511号,08:00-17:30
江苏省,苏州,倍耐力(嘉腾汽车一站式),18913128107,吴中区龙西路98号,08:00-17:30
江苏省,苏州,车享家（苏州云庭路店）,051268225362,姑苏区云庭路3-4-5号,09:00-17:30
江苏省,苏州,正新轮胎（新友汽车服务）,18915553222,姑苏区友新路友联二村85幢104座,08:00-18:00
江苏省,苏州,嘉实多(阿香车一站式汽车服务),13338691453,虎丘区金山路3号,08:30-18:00
江苏省,苏州,骏逸车利捷（新区店）,18012772225,虎丘区鹿山路85号4号楼,09:00-18:00
江苏省,苏州,爱客汽车服务连锁（吴中店）,18913521260,吴中区水香街190号,08:00-17:00
江苏省,苏州,新奇特汽车服务（盘蠡路店）,051282283569,吴中区盘蠡路水香六村19幢,09:00-18:00
江苏省,苏州,骏逸一站式汽车服务（精维店）,18118110810,姑苏区桐泾南路311号,07:40-18:00
江苏省,苏州,韩泰轮胎（康隆汽车维修服务部）,13862575358,姑苏区南环西路651号,09:00-17:30
江苏省,苏州,米其林轮胎（竞驰汽车服务有限公司）,15850214158,吴中区尹中路66号商铺1-103号,08:30-17:00
江苏省,苏州,睿君汽车,15850192526,吴中区东吴北路新苏国际大厦负二楼,09:00-18:00
江苏省,苏州,车享家（苏州长江路店）,051265368875,虎丘区长江路612号,09:00-17:30
江苏省,苏州,道达尔(车迪仕汽车服务中心),18013566739,吴中区郭巷镇彩虹路37号,08:00-17:00
江苏省,苏州,仙奇车业,17712631582,吴中区郭巷彩虹路43号,08:00-17:00
江苏省,苏州,车马驿站汽车服务,18662268617,吴中区文曲路203号,08:00-17:00
江苏省,苏州,壳牌（养车堂一站式服务中心）,13625284172,吴中区文曲路280号,07:30-17:00
江苏省,苏州,乐驾汽车服务有限公司,18118162889,吴中区文曲路232号,08:00-17:00
江苏省,苏州,富鑫汽车一站式服务,15306139566,吴中区吴中东路118号,08:00-17:30
江苏省,苏州,车享家（苏州吴中东路店）,051267074359,吴中区吴中东路119-5号,09:00-17:30
江苏省,苏州,APEX(豪门汽车会所),13915503757,吴中区迎春路174号,08:00-17:00
江苏省,苏州,佳良汽车用品,18012616299,姑苏区西园路767号闻钟苑12幢,09:00-18:00
江苏省,苏州,美孚（威杰汽车服务有限公司）,18118161769,姑苏区金门路小商品市场出口处,08:00-17:00
江苏省,苏州,车享家（苏州南环东路店）,051268556965,姑苏区南环东路869-875号,09:00-17:30
江苏省,苏州,宝雪龙汽车服务中心,18662172355,吴中区吴东路1198号,08:00-17:00
江苏省,苏州,骏逸一站式汽车服务连锁(东环店),17625580629,吴中区吴东路1111号,08:00-17:00
江苏省,苏州,盛唐汽修美容,13776040053,姑苏区南环大街279号正南方向70米,08:00-17:00
江苏省,苏州,苏州锦安汽车一站式服务中心,13405055222,虎丘区运新路15号（鸿基科技园东北门）,08:00-19:00
江苏省,苏州,众驰汽修,15250049149,吴中区纬二路综合保税区A楼背面,08:00-17:00
江苏省,苏州,车艺骏汽车服务,18260116202,姑苏区锦南巷77号（姑苏生鲜南环市场B1层 ）,08:00-18:30
江苏省,苏州,李健汽车快修,15190069722,虎丘区兴贤路阳山花苑一区102幢,08:00-17:00
江苏省,苏州,马上汽车（南门路店）,15850129291,姑苏区南门路851号,08:30-19:00
江苏省,苏州,标龙汽修（新区店）,17371532878,虎丘区长江路858号,08:00-17:30
江苏省,苏州,集结号汽车服务中心,15150424029,虎丘区长江路876号中交名品商务广场3幢107,09:00-18:00
江苏省,苏州,加德士（赣商阳阳汽车服务）,18913159818,姑苏区西环路3108号,07:30-19:00
江苏省,苏州,美仕途汽车生活馆,17729955551,姑苏区虎阜路999号虎丘婚纱B区负1楼b3入口,09:00-18:00
江苏省,苏州,维车仕车业,13862053967,吴中区叠翠峰东门1幢101室,08:00-17:30
江苏省,苏州,三道汽车,18912621921,苏州工业园区东兴路118号星叶广场负一楼,08:00-18:00
江苏省,苏州,有车一族汽车美容装潢店,18915505682,姑苏区南园北路6号,08:30-17:00
江苏省,苏州,龙捷快修(浒关店),18136177100,虎丘区文昌路天玺街负一层,09:00-18:00
江苏省,苏州,80车盟,13915578827,苏州工业园区东方大道双银国际金融城4-1238,08:00-17:00
江苏省,苏州,车享家（苏州东兴路店）,051265152595,苏州工业园区东兴路38号,09:00-17:30
江苏省,苏州,神彩汽车养护中心,15806216013,姑苏区杨枝塘路102号,07:30-18:30
江苏省,苏州,夏园汽车一站式服务（湖岸名家店）,18913606652,苏州工业园区通达路1875-1号,08:00-17:00
江苏省,苏州,邓禄普（靓途批发零售店）,18994313449,相城区迎湖路8号,09:00-18:00
江苏省,苏州,玛吉斯（靓途车业）,18994313449,相城区迎湖路2号,08:15-16:50
江苏省,苏州,龙捷快修（广济店）,13771684881,姑苏区钱万里桥公交首末站,08:00-17:00
江苏省,苏州,鑫宏汽车一站式服务（旗舰店）,13073362262,相城区问渡路12号,09:00-18:00
江苏省,苏州,宝雪龙汽车维修服务公司,17761941563,姑苏区葑门路10号,09:00-18:00
江苏省,苏州,艾车宝汽车维修服务部,13205176642,姑苏区虎殿路与陆步桥街交叉口南100米,07:30-18:30
江苏省,苏州,车驿堂汽车,18061937880,苏州工业园区万科美好广场负一层,10:00-18:00
江苏省,苏州,曼塔汽车服务中心,15365314639,苏州工业园区星湖街218号生物纳米B2负一层,08:00-17:00
江苏省,苏州,车享家（苏州平泷路店）,051267529370,姑苏区平泷路1258号105室,09:00-17:30
江苏省,苏州,加德士（捷驰汽车维修服务）,13013812568,姑苏区平川路锦芳街苏锦一村小区大门口,08:00-18:00
江苏省,苏州,苏州车易润,18362724516,姑苏区平齐路平齐花苑14幢107室,08:00-17:00
江苏省,苏州,马上汽车（贵都服务店）,15250933922,苏州工业园区贵都邻里中心天天向上斜对面,09:00-17:00
江苏省,苏州,美孚（星程汽车美容装潢）,15962256163,姑苏区锦荷街103号,08:30-17:00
江苏省,苏州,长城一站式汽车服务中心,15952403181,苏州工业园区工业技术学校东门,08:00-17:00
江苏省,苏州,马上汽修（惠邻汽车）,13862045218,苏州工业园区斜塘街道车坊东方文荟苑21-109店铺,07:00-18:00
江苏省,苏州,森诚汽车维修服务中心,15250062929,姑苏区齐门外大街313号,08:10-18:30
江苏省,苏州,爱客汽车服务连锁（独墅湖店）,0512-66986900,苏州工业园区若水路1号,08:00-18:00
江苏省,苏州,骏逸车业（园区卡马仕店）,18151092525,苏州工业园区苏慕路117号（湖西派出所旁）,08:00-18:00
江苏省,苏州,壳牌(苏州万福源汽车服务有限公司),15150451577，18896500288,苏州工业园区娄门路86号,08:00-17:00
江苏省,苏州,美车饰汽车一站式服务中心,18912797873,苏州工业园区苏虹西路百合街10号,07:30-18:00
江苏省,苏州,龙捷汽修(繁花店),15950068460,相城区澄湖西路964号繁花中心地下负二楼,09:00-21:00
江苏省,苏州,欧德联一站式汽车服务（相城店）,18606209696,相城区黄桥镇永旺家园东100米,08:00-18:00
江苏省,苏州,嘉实多（馨车航汽车服务部）,15062344305,相城区善济路107号合景峰汇3期,08:00-18:00
江苏省,苏州,车享家（苏州人民路店）,051265866996,相城区人民路与聚贤路交汇处峰汇商务广场3幢124室一层,09:00-17:30
江苏省,苏州,车享家（苏州星湖街店）,051262981961,苏州工业园区星湖街1260-1262号,09:00-17:30
江苏省,苏州,迪奥迪美汽车修理有限公司,15051401855,相城区春申湖西路901号,09:00-18:00
江苏省,苏州,苏州车无忧,15699998849,相城区沈思港路95号,08:00-18:00
江苏省,苏州,苏州车侣汽车服务有限公司,13402699183,相城区荷馨街95号,07:30-18:00
江苏省,苏州,龙捷快修（相城店）,13625270994,相城区齐门北大街71号,08:00-17:00
江苏省,苏州,韦尔斯(名车之旅),13004515468,相城区长旺路97号,09:00-18:00
江苏省,苏州,航盛车业一站式汽车服务连锁,0512-62511555,苏州工业园区东福路45号,09:00-18:00
江苏省,苏州,奇胜汽车一站式服务中心,05126630669,苏州工业园区东富路32号,08:00-18:00
江苏省,苏州,车子佳汽车连锁,13701410469,相城区兴旺路1号,09:00-18:00
江苏省,苏州,加德士（车之杰汽车会所）,15250027413,相城区苏隶方浜加油站向南30米,08:00-18:30
江苏省,苏州,兴塘豪华车专修连锁（园区店）,15370198866,苏州工业园区民生路28号,08:00-17:00
江苏省,苏州,佳诚汽车服务中心,15050409111,相城区元和街道聚元街475号,07:00-19:30
江苏省,苏州,捷美汽车美容,18261894006,相城区齐门北大街1578号,09:00-18:00
江苏省,苏州,朋城汽修,18118449166,苏州工业园区孟下村笛普智慧智慧园,08:00-17:00
江苏省,苏州,名华汽车一站式服务中心,18550086238,相城区齐门北大街1598号,07:30-19:00
江苏省,苏州,道得尔（传胜汽车会所）,15950041757,相城区春申湖中路283号,09:00-18:00
江苏省,苏州,一番车道（苏虹中路店）,18621378956,苏州工业园区苏虹中路399号,09:00-18:00
江苏省,苏州,爱客汽车服务连锁(苏虹路店),051262583303,苏州工业园区苏虹中路399号7幢1号单元,09:00-18:00
江苏省,苏州,宝车仕汽车一站式服务,17625586208,相城区书香路9号,05:00-20:00
江苏省,苏州,车利捷（相城店）,18915556918,相城区华元路99号,07:40-17:30
江苏省,苏州,后浪汽车服务,18962111418,苏州工业园区唯亭葑亭大道678号4号厂房,08:00-17:00
江苏省,苏州,轟众车业一站式汽车服务中心,15250114558,相城区澄云路31号,08:00-17:00
江苏省,苏州,华胜车业连锁（园区店）,13814497940,苏州工业园区苏虹中路45号,08:30-17:00
江苏省,苏州,龙捷汽修（广前店）,17751294225,相城区广前路11号广济医院地下停车负一楼,08:30-17:00
江苏省,苏州,正新轮胎(甪直正新汽车维修部),18506217832,吴中区甪直镇甫澄北路12号甫澄熙岸二期西门,8:00:-17:00
江苏省,苏州,车享家（苏州亭盛街店）,051265914553,苏州工业园区亭盛街65幢101-103号,09:00-17:30
江苏省,苏州,美孚（易加能汽车美容养护）,18118477176,苏州工业园区亭盛街50号唯盛邻里中心负一楼,09:00-19:30
江苏省,苏州,清风车业维修保养中心,15262411197,苏州工业园区胜浦瑞祥商业广场2栋133-135室,08:00-17:30
江苏省,苏州,爱车逸族,18115512325,苏州工业园区星龙街298号,09:00-17:00
江苏省,苏州,美孚（甪捷汽车维修）,13584888145,吴中区甪直镇育才路1号,08:00-17:00
江苏省,苏州,乐语汽车修理厂,18862337020,苏州工业园区唯新路7号,08:30-17:00
江苏省,苏州,德国马牌（宏达汽修一站式）,13656244639,昆山市震阳路88号,09:00-18:00
江苏省,苏州,渡客车业,13913501787,苏州工业园区葑亭大道355号,08:00-17:30
江苏省,苏州,苏皖汽车养护,15995831792,苏州工业园区金陵西路商业街2期,07:00-17:30
江苏省,苏州,矫马(金扳手漕湖维修中心),18550208029,相城区漕湖商业广场4-108号,08:30-17:00
江苏省,苏州,龙捷快修（漕湖店）,0512-65720981,相城区观塘路漕湖邻里中心1楼F144号（西南角）,09:00-18:00
江苏省,苏州,米其林（志诚乐乐汽车一站式服务）,0512-67591767,相城区兴太路22号,08:30-19:00
江苏省,苏州,壳牌（欧泰汽车维修）,18662518831,相城区太平街道开泰路1576号,08:00-18:00
江苏省,苏州,正新轮胎(顺佳轮胎有限公司),13815258572,苏州工业园区金陵东路338号,08:00-17:00
江苏省,苏州,车享家（苏州太东路店）,051265448950,相城区太平街道太东路2号7-103-105,09:00-17:30
江苏省,苏州,车缘点（太平店）,18020597877,相城区太平金澄广场9幢30号,08:00-18:00
江苏省,苏州,车易好汽车维修股份有限公司,18662271958,相城区河东路2-12号,08:10-18:00
江苏省,苏州,路航（车居士汽车服务中心）,17857252655,相城区太平镇富升路3号,08:00-17:00
江苏省,苏州,车艺匠汽修,13776045214,相城区珍珠湖路12号,08:00-18:00
江苏省,苏州,车享家（苏州澄阳路店）,051266834647,相城区渭塘镇澄阳路2588号110室,09:00-17:30
江苏省,苏州,御祥一站式汽车服务,15190152375,昆山市千灯镇南浦东路508号,08:00-20:00
江苏省,苏州,路欧峰（豫北汽车用品店）,15001877862,昆山市炎东路5号,06:30-23:59
江苏省,苏州,车享家（苏州昆山人和路店）,051250151998,昆山市千灯镇人和路225-229号,09:00-17:30
江苏省,苏州,车帝一站式汽车服务,18118173444,昆山市南浦东路154号,09:00-18:00
江苏省,苏州,豪车码头汽车服务中心,18662355269,昆山市名人华城33栋27号,07:30-20:00
江苏省,苏州,帝车会汽车服务中心,15050217638,昆山市千灯镇少卿西路510号,07:00-16:30
江苏省,苏州,玛吉斯（博众汽车美容维修）,18013287746,昆山市南湾路836号,09:00-18:00
江苏省,苏州,嘉实多(小岳汽车服务中心),13218174256,相城区凤北公路与相城大道交叉口北100米,09:00-18:00
江苏省,苏州,车厘子理车（千灯店）,15250200155,昆山市千灯镇少卿路3号3幢,08:00-19:00
