江苏省,苏州,普利司通（千灯店）,13584958084,昆山市秦峰花园32号,09:00-18:00
江苏省,苏州,轟众车业（阳澄湖店）,18015655755,相城区凤阳路318号,08:00-17:30
江苏省,苏州,车俊翔汽车美容服务中心,18255679918,昆山市巴城镇通澄向日葵花园81号楼103商铺,07:30-21:00
江苏省,苏州,车享家（苏州昆山前进西路店）,051236910121,昆山市巴城镇通澄花园四期81幢101号,09:00-17:30
江苏省,苏州,壳牌（天使爱车一站式服务）,15895651431,昆山市明澄路257号,07:30-18:30
江苏省,苏州,安耐普养护快修服务中心,18862173918,昆山市巴城镇金澄路279号,09:00-18:00
江苏省,苏州,苏州正车堂汽车服务有限公司,13771935130,相城区凤阳路163号,09:00-18:00
江苏省,苏州,嘉实多（艺车堂一站式汽车服务）,13771892090,相城区凤阳路159号,08:00-18:00
江苏省,苏州,美孚（车品会汽车服务中心）,13912657663,昆山市创业路588号,07:30-18:30
江苏省,苏州,欧德耐汽车生活馆,18917577781,昆山市衡山路288号,08:00-19:00
江苏省,苏州,德骏行,13806268244,昆山市城西民新路1号,08:00-18:00
江苏省,苏州,迪奥车业,18662516555,常熟市辛庄新阳大道65-1号,09:00-18:00
江苏省,苏州,壳牌（车之隆一站式服务中心）,15150468225,昆山市合兴西路189号,07:20-19:00
江苏省,苏州,汽车e族一站式服务,13218175993,常熟市新阳大道57号,09:00-18:00
江苏省,苏州,昆山树德汽车用品有限公司,18912689788,昆山市陆家镇陆丰西路88号建伟国际汽车城7幢24号,08:00-18:00
江苏省,苏州,正新（唐彪汽修美容）,13616268247,昆山市联谊路251号,07:00-22:00
江苏省,苏州,MOTUL(小赵汽车服务),18012661250,昆山市鹿城路605号,09:00-18:00
江苏省,苏州,玛吉斯（晟通车业）,18662549801,昆山市友谊东路001号,09:00-18:00
江苏省,苏州,韩泰轮胎（清风车影）,15151669178,昆山市玉山镇鹿城路750-756号,09:00-18:00
江苏省,苏州,卡诺嘉（爱车一族）,17372615250,昆山市长江南路1164号,08:00-18:00
江苏省,苏州,车享家（苏州昆山庆丰东路店）,051250161686,昆山市庆丰东路345-351号,09:00-17:30
江苏省,苏州,美车有道,13764130773,昆山市春天大道258号20室,07:40-21:00
江苏省,苏州,美车有道(花桥店),18702101455,昆山市春天大道258号20室,08:00-20:00
江苏省,苏州,有途汽车服务部（花园路店）,17712471773,昆山市花园路1915号,09:00-18:00
江苏省,苏州,车之邦一站式汽车服务中心,18602159462,昆山市花园路1731号,08:00-18:30
江苏省,苏州,德国马牌（联浩轮胎商行）,15006267849,昆山市巷浦路1号,09:00-18:00
江苏省,苏州,苏雄汽车服务部,18626248753,昆山市景王路33号,08:00-19:00
江苏省,苏州,道得尔（艺荣车臣汽车养护中心）,15921780163,昆山市商银路1255号,08:00-20:00
江苏省,苏州,车艺驰车体极致护理,15155761823,昆山市花桥镇绿地大道双联国际1幢,08:00-18:00
江苏省,苏州,牛牛车坊,15221616818,昆山市商银路1255号6栋001（双联国际商务中心）,09:00-18:00
江苏省,苏州,海睿汽修服务中心,17501429325,昆山市玉山镇昆太路686号,07:00-19:00
江苏省,苏州,舒车堂汽车服务连锁,18118176295,昆山市富士康路1183号,09:00-18:00
江苏省,苏州,车厘子理车,17712473607,昆山市前进东路1008号,07:30-18:00
江苏省,苏州,车感觉汽车维修养护,19951267427,昆山市花安路430号,08:00-18:00
江苏省,苏州,懂车帝汽车保养维修中心,13245057777,昆山市横泾路与昆太路交叉口,08:00-18:00
江苏省,苏州,车享家（苏州昆山春晖路店）,051236691320,昆山市周市镇春晖路611号一层部分商铺、613号一层部分商铺,09:00-17:30
江苏省,苏州,昆山鸿隆汽车服务有限公司,13052889488,昆山市昆嘉路341号,08:20-18:00
江苏省,苏州,车享家（苏州昆山金浦路店）,051257995286,昆山市周市镇金浦路344号,09:00-17:30
江苏省,苏州,米其林（安通轮胎）,15906516973,昆山市青阳北路168号,08:00-18:00
江苏省,苏州,尚美汽车一站式服务,15162679275,昆山市白塔路黄金海岸西门,09:00-18:00
江苏省,苏州,洁美汽车养护中心,15298832699,常熟市东升路33号,05:00-23:00
江苏省,苏州,宝捷龙车业,17312670655,昆山市萧林东路1258号,08:00-18:30
江苏省,苏州,壳牌（广顺汽车服务部）,13773020377,常熟市练塘大道16号,07:00-20:00
江苏省,苏州,玛吉斯（天文路店）,13817469661,昆山市天文路20号,07:30-17:00
江苏省,苏州,养车坊汽车服务中心（华寓路店）,13584993260,昆山市华寓路与石鑫路交口东行50米路北（环湖佳苑1号楼）,07:30-18:00
江苏省,苏州,茂林汽修,15062666041,昆山市华寓路与石鑫路交口东行50米路北（环湖佳苑1号楼）,07:00-20:00
江苏省,苏州,路欧峰（小蒋汽车美容）,18112757505,常熟市尚湖大道工商银行旁,09:00-18:00
江苏省,苏州,快捷汽车服务,18361997311,昆山市蓬溪北路882号,07:00-18:00
江苏省,苏州,华云汽车服务中心,13584900236,昆山市蓬莱路53号,06:00-23:59
江苏省,苏州,恒源汽修一站式服务,18914978690,昆山市益伸路489号,09:00-18:00
江苏省,苏州,车享家（苏州常熟汇金一路店）,051252179130,常熟市湖山路333号同济科技广场2号楼114-116室,09:00-17:30
江苏省,苏州,嘉实多（昆山至尊汽车服务）,18068074772,昆山市周新路与永工路交叉口西南150米,08:00-18:00
江苏省,苏州,勇顺汽车服务部,15962483177,常熟市三塘路234号,07:00-18:30
江苏省,苏州,枫林汽车,13372127333,常熟市枫林路205号,09:00-18:00
江苏省,苏州,养车堡汽车养护中心,13915584237,常熟市琴湖广场五号楼121号,08:30-17:00
江苏省,苏州,固特异轮胎（太仓启驾汽车）,15051632161,太仓市东古路2号,07:30-18:30
江苏省,苏州,速锐汽修服务部,15895563011,太仓市东古路2-28号,08:00-18:30
江苏省,苏州,韦尔斯（路路通汽车美容装饰中心）,15851519694,常熟市琴湖路268号,09:00-18:00
江苏省,苏州,欧帕斯（靓车点汽车装饰）,13814583489,太仓市长春南路12号,07:30-17:30
江苏省,苏州,邓禄普轮胎（富康汽车美容装潢）,13962498245,常熟市富康路16号,09:00-18:00
江苏省,苏州,车友汇汽车一站式服务,15161592401,太仓市上海西路53号,08:30-17:30
江苏省,苏州,壳牌(甬江汽车维修养护中心),13773027463,常熟市甬江路20号,09:00-18:00
江苏省,苏州,畅速汽车养护中心,18796893073,太仓市长春北路9-2号,08:00-17:00
江苏省,苏州,车享家（苏州常熟黄河路店）,051252832163,常熟市黄河路777号佳和商业中心5幢103号,09:00-17:30
江苏省,苏州,欧罗来（新感觉汽车）,18550029720,常熟市珠江路168号,09:00-18:00
江苏省,苏州,鑫顺汽车美容装潢中心,18151575556,常熟市李闸路395-1号,09:00-18:00
江苏省,苏州,菱威汽车服务有限公司,18962329199,常熟市文学街722号,08:00-17:00
江苏省,苏州,诚力好先生,13306223753,太仓市人民北路30号,08:00-18:30
江苏省,苏州,车享家（苏州常熟珠江东路店）,051252416231,常熟市珠江东路世贸世纪中心-创富世纪3幢103-104号,09:00-17:30
江苏省,苏州,洗车人家（锦州路口店）,13862295812,太仓市朝阳路锦州路口,08:00-17:00
江苏省,苏州,德国马牌（宁鸿汽车）,15962494699,常熟市文学街与金源路交叉口,09:00-18:00
江苏省,苏州,百隆汽车一站式服务,15051661331,太仓市朝阳东路22号,08:00-18:00
江苏省,苏州,爱车计划服务连锁,18552019669,太仓市太平北路66号,08:30-17:30
江苏省,苏州,雷霆车友,15150379771,常熟市勤丰路53号,09:00-18:00
江苏省,苏州,航顺达汽车美容,15851560763,常熟市古里镇政府斜对面,07:30-18:00
江苏省,苏州,邓禄普（凤凰车浩饰洗车行）,15366261338,张家港市凤凰路40-15号,07:00-20:00
江苏省,苏州,思家车汽修,18795490582,太仓市郑和中路万鸿塞纳丽舍21号楼,08:00-17:00
江苏省,苏州,凯特一站式服务中心,15162569486,常熟市老街静海路老街一期南门对面,06:30-19:00
江苏省,苏州,车享家（苏州太仓滨河东路店）,051253577235,太仓市滨河路168-34号,09:00-17:30
江苏省,苏州,车享家（苏州太仓郑和中路店）,051253201013,太仓市郑和中路376号塞纳丽舍20幢8号一层,09:00-17:30
江苏省,苏州,胜华车业有限公司一站式服务,15051497719,常熟市常浒路2888号,08:00-20:00
江苏省,苏州,卡卡爱车俱乐部,13182682112,太仓市郑和中路65号,08:00-17:00
江苏省,苏州,精诚汽车养护中心,15861633165,张家港市凤凰镇栏杆桥100号,07:00-20:00
江苏省,苏州,睿洗超级中心,051253978237,太仓市天津路100号,08:10-16:30
江苏省,苏州,东昇杰汽车美容装潢,15851625235,张家港市吴湖路1号,07:00-18:00
江苏省,苏州,爱车地带汽车维修一站式服务,15962332863,常熟市常浒公路32号（大虹桥警务室旁）,07:00-18:00
江苏省,苏州,嘉途汽车服务,17712692213,太仓市常胜北路50号,07:30-20:00
江苏省,苏州,浩羽汽车养护,13862227872,张家港市东区大道与汤联路交叉口西150米,08:30-16:30
江苏省,苏州,鸿安汽车养护中心,15666902928,太仓市常胜北路50号1幢101室,08:00-17:00
江苏省,苏州,168汽车俱乐部旗舰店,13773269606,张家港市金港大道338号,09:00-18:00
江苏省,苏州,德国马牌（宝驰汽车服务有限公司）,15021153789,张家港市金谷路1号,07:10-20:00
江苏省,苏州,锦源汽车维修养护中心,13665185307,张家港市凤凰镇西张西秒路金谷小区九栋105,09:00-18:00
江苏省,苏州,车护士汽车美容装潢（金港镇）,15358896445,张家港市江海南路39号,09:00-18:00
江苏省,苏州,车仕多汽车一站式服务,13338027125,常熟市西环路2号108室,07:30-23:59
江苏省,苏州,金典汽车美容装饰服务部,18962286736,张家港市馨苑路61-63号,09:00-18:00
江苏省,苏州,车享家（苏州张家港馨苑路店）,051256900019,张家港市杨舍镇湖东花苑房号7幢-M5,09:00-17:30
江苏省,苏州,宣路达汽车一站式服务,15995590922,太仓市板桥路113号,07:00-19:00
江苏省,苏州,骆驼蓄电池(云修连锁汽车服务中心）,15298806695,张家港市文星南路后塍新塍小区大门口,09:00-18:00
江苏省,苏州,车管家汽车装饰服务部,17351256787,张家港市东山南路68号,07:00-23:00
江苏省,苏州,美车堂(小菜巷路店),15851666181,张家港市小菜巷路25号,08:00-17:00
江苏省,苏州,快乐洗车中心（浦家湾弄店）,18013615767,张家港市浦家湾弄15号,07:00-17:00
江苏省,苏州,龙捷快修（客运站店）,17751191811,张家港市华昌南路3号,09:00-18:00
江苏省,苏州,优科豪马（天涯汽车美容装饰）,18118113315,张家港市河西南路95号,07:00-19:30
江苏省,苏州,壳牌（零距离车饰）,15371881803,常熟市香州路15号,08:00-18:00
江苏省,苏州,车享家（苏州张家港东环路店）,051258261196,张家港市东环路皇家首座23-27号,09:00-17:30
江苏省,苏州,诚辉汽车换油服务中心,18114592311,张家港市水站陆家巷37号,08:30-18:00
江苏省,苏州,车享家（苏州张家港南苑东路店）,051258261192,张家港市南苑东路29号帝景豪园南门10栋35号,09:00-17:30
江苏省,苏州,阿特拉斯轮胎（建宏汽车）,13262988855,张家港市港城大道182号,09:00-18:00
江苏省,苏州,运恒汽车生活馆,15206224447,太仓市沙溪镇印溪南路,08:00-18:30
江苏省,苏州,酷车汇汽车服务部（沙溪店）,13771161351,太仓市沙南西路98号,08:00-19:00
江苏省,苏州,车臣汽车美容养护中心,18626221265,太仓市中市东路东方雅苑6-1号,08:00-17:00
江苏省,苏州,美泊莱汽车维修服务中心,18021640935,张家港市天台南路156号,07:30-19:00
江苏省,苏州,百援汽车连锁服务中心,18915672868,张家港市黄泗浦西路137号,06:00-18:00
江苏省,苏州,途马汽车养护中心,15151515883,张家港市蟠港南路49号,07:00-20:00
江苏省,苏州,玛吉斯（车之恋换油养护服务有限公司）,18605120494,张家港市敬安路8号,08:00-17:00
江苏省,苏州,光明汽修,13962235101,张家港市蒋乘路28号,07:30-18:00
江苏省,苏州,博世汽车专业维修（金港镇店）,13776099446,张家港市中圩路与江海中路交叉口东150米,07:40-17:30
江苏省,苏州,蒸功夫汽车服务部,18021633807,常熟市学前路17号,07:00-23:37
江苏省,苏州,奔帝汽车美容装潢服务部,18962411982,太仓市印溪东路662号,08:00-17:00
江苏省,苏州,博胜汽车服务有限公司,18551111366,太仓市印溪东路662号,08:00-17:00
江苏省,苏州,超人汽车会,18662637793,张家港市中港北路3号,07:55-18:34
江苏省,苏州,米其林（中兴路店）,15962395313,张家港市中兴路红绿灯东10米,07:30-17:30
江苏省,苏州,张家港凯瑞达汽车养护装潢中心,18921997117,张家港市和鑫路和鑫花园社区对面,09:00-18:00
江苏省,苏州,锦鸿汽车维修美容中心,13862319969,常熟市府前路欧德福超市后面,07:30-19:00
江苏省,苏州,翔顺汽车装潢部,18962338536,常熟市梅北路55-19号,09:00-18:00
江苏省,苏州,隆腾汽车美容服务中心,13584418762,张家港市世晨锦苑M16号,08:00-17:00
江苏省,苏州,广东顺发汽车装潢,15051767317,常熟市人民路92号,09:00-18:00
江苏省,苏州,爱尚车汽修美容,13041898060,常熟市通江路26号,09:00-18:00
江苏省,苏州,金标汽车换油服务中心,18550134030,张家港市银苑中路与银苑西路交叉口西50米,09:00-18:00
江苏省,苏州,车百科汽车装潢美容,15301572991,常熟市人民路76-78号,07:00-20:00
江苏省,苏州,玛吉斯轮胎（德成鑫汽车养护服务部）,13913636201,常熟市梅李镇交警中队北100米,07:00-21:00
江苏省,苏州,玛吉斯（新港公路店）,15051504421,太仓市新港中路258号,09:30-16:30
江苏省,苏州,正新轮胎（车之佳汽车养护）,13814994844,常熟市何市公交车站斜对面,09:00-18:00
江苏省,苏州,强盛汽车美容装潢中心,051253290857,太仓市归北路18号,08:00-17:00
江苏省,苏州,小广汽车装饰,13862287123,太仓市郑和路888号,07:30-17:30
江苏省,苏州,爱车宝汽修,13651702262,太仓市郑和东路88-4号,06:00-18:00
江苏省,苏州,牌楼汽车美容生活馆,15150317172,太仓市浏双线117号,07:00-18:00
江苏省,苏州,财神驾道（小广东车饰）,13814911202,常熟市新溪路38号,09:00-18:00
江苏省,苏州,泉鑫汽车养护,16605204619,张家港市新联花苑37幢26-27号,07:40-18:00
江苏省,苏州,通达汽车维修汽配,15150202046,张家港市杨锦公路56号,06:00-23:00
江苏省,苏州,美邦汽车,15250365076,张家港市府前路阳光家园北门M03号,08:00-18:00
江苏省,苏州,益思特汽车服务中心,17625396290,张家港市府前路富华佳园2-30号 ,08:00-18:30
江苏省,苏州,永通汽修汽配,13952420755,太仓市龙江路大转盘向北200米路东侧,08:00-17:00
江苏省,苏州,车世界美容会所（璜泾店）,17351717802,太仓市璜泾沙鹿路新华侨,08:00-17:00
江苏省,苏州,红壹佰汽车美容装饰,18013778500,太仓市璜泾镇荣文路与永乐环路交叉路口东一百米,08:00-17:00
江苏省,苏州,小鲍汽车美容中心,13196614801,太仓市荣文路幼儿园向东400米,07:00-19:00
江苏省,苏州,捷豪汽修,13776286977,太仓市新港东路上海春天小区靠东,08:00-17:00
江苏省,苏州,亿佳汽车美容装饰,13913689903,太仓市棉北路108号,05:30-20:00
江苏省,苏州,晶秀汽车维修服务中心,13814580768,太仓市和平路南天主题酒店南100米,08:00-17:00
江苏省,苏州,闸北汽车美容装潢,15580853631,太仓市中兴街54号,09:00-17:00
江苏省,苏州,青中汽车美容装潢部,13962458158,张家港市乐兴南路星辰花苑9幢98号,09:00-18:00
江苏省,苏州,盛达汽车换油中心,18913616196,张家港市华润路2号（金鹿集团正大门斜对面）,09:00-18:00
江苏省,苏州,洗车人家汽车服务（江海汇店）,15995995052,张家港市永新路与青年路交叉口（锦都中央广场1幢）,08:03-18:03
江苏省,苏州,车享家（苏州张家港永新路店）,051256956833,张家港市锦丰镇锦苑1幢104~107室,09:00-17:30
