福发汽车美容养护,15919794622,深圳,福田区新桥芙蓉六路2号,08:00-20:00,
车汇汽车维修中心,18823833303,深圳,福田区沙头街道天安社区泰然二路泰然科技园202栋,09:00-21:00,
泰吉华洗车,15099949057,深圳,福田区车公庙安华工业区八栋101号,07:00-21:00,
建龙汽车美容中心,13612881885,深圳,福田区香梅路香梅南4街001号,07:30-19:00,
捷诚宝名车服务,13715332242,深圳,福田区侨城东路创意侨园裙楼,08:30-20:30,
兴光车业汽车服务,075583057162,深圳,福田区景田路21号（金色假日一层）,07:30-20:30,
大师修车（新洲店）,13316589741,深圳,福田区下梅林嘉梅小区1栋1层,08:00-18:00,
博士卡汽车养护中心,15386257129,深圳,福田区梅林红梅苑11-13号,09:00-18:00,
梅林四村洗车房,18028791359,深圳,福田区梅林路52号,07:00-20:00,
金三角汽车美容服务中心,13714918448,深圳,南山区沙河二街金三角大厦停车场,08:00-19:00,
爱车空间(华强北店),075583346233,深圳,福田区华富路1046号,09:00-18:00,
IQ车坊—爱车者,13417444457,深圳,福田区滨河大厦3159号,08:30-20:30,
深圳市天韵汽车美容服务中心,15817231642,深圳,龙华区金龙路逸秀新村131栋一楼,09:00-18:00,
鹏圳汽车服务有限公司,13040828882,深圳,龙岗区民治街道滢水山庄一区三栋75-83号,09:00-18:00,
A车道汽车服务,15361093423,深圳,龙华区民治街道民泰社区梅龙路维也 纳酒店对面粤通综合楼B座5号(梅龙公路 60号) ,09:00-20:00,
车工妙汽车美容,18620397579,深圳,南山区粤海街道科技园社区科苑路16号东方科技大厦113,08:00-20:00,
深圳市车里程汽车服务有限公司,13682409277,深圳,南山区西丽南路33号,08:00-19:00,
鑫安驰一站式汽车服务,15767316239,深圳,龙岗区民治街道梅坂大道民乐工业园圆梦科技大厦1楼5-8号铺,08:30-19:00,
雅丽源汽车美容中心,13922882136,深圳,南山区沙河西路3285号,07:30-18:30,
靓车汇一站式汽车美容维修,18682287179,深圳,南山区西丽路德意名居113-114号,09:00-19:00,
佳乐汽车美容,13603018941,深圳,龙岗区民治街道民新社区横岭工业区 8栋101号,08:30-18:30,
美孚（金轮汇汽车服务）,18822890317,深圳,龙岗区五和南路2号,08:30-18:00,
永信汽车服务有限公司,13430896453,深圳,南山区高新中一道12号,09:00-18:00,
金手指汽车快修,13316923005,深圳,罗湖区金湖路北山居26号,08:30-19:00,
美一佳汽车服务中心,13424350489,深圳,龙华区民治街道横岭4区19栋1楼,09:30-18:00,
恒丰汽车服务（南山店）,13590358167,深圳,南山区西丽镇新高路旺棠工业区18栋101-102号,09:00-18:00,
深圳驹驹汽车服务,13717025286,深圳,罗湖区八卦九街15栋,09:00-19:00,
江兴汽车美容,13798298255,深圳,罗湖区八卦食街八卦二路35幢,09:00-18:00,
车世界名车服务中心,13510919016,深圳,龙岗区坂田街道南坑社区麒麟路9号,09:00-18:00,
博源汽车服务有限公司,13560761900,深圳,南山区西丽新高路华通大厦1楼,06:00-18:00,
麒麟汽修美容,13826545917,深圳,南山区玉泉路15号,08:30-20:00,
启越汇一站式汽车服务中心,075521038210,深圳,龙岗区民治街道民康路民兴工业区9栋1楼,08:30-19:00,
大圣车服（易达龙华店）,0755-83311289,深圳,龙岗区龙华新区民康路1号处名车广场8号仓负一层,09:00-18:00,
锋动汽车服务,13632853534,深圳,南山区官龙学子荔园首层,08:00-18:00,
美孚(友通汽车服务中心),13728886343,深圳,龙华区民治第一工业区2栋,08:00-20:30,
车爵士汽车服务（龙岗店）,18898792180,深圳,龙岗区坂田街道永甘路2号,06:00-18:00,
大拇指爱车俱乐部,13728658266,深圳,龙岗区民康路58号（华南物流对面）,08:30-19:30,
诚鑫达汽车维修美容,075586192366,深圳,南山区马家龙工业区艺园路23栋188号,08:00-19:00,
龙宝汽车维修,13725515803,深圳,罗湖区桃园路东37号,08:00-18:00,
合时合胜汽车美容中心,15112616112,深圳,罗湖区笋岗街道宝岗路宝岗花园1栋 106右旁,08:00-19:00,
龙绍汽车服务,18823321663,深圳,南山区南海大道2088,08:00-18:00,
车马仕汽车服务,18923482782,深圳,南山区登良路70号,08:00-18:00,
藏巴拉名车服务中心,13510767672,深圳,南山区桂庙路向南西海花园B栋06号,08:00-20:00,
尚车酷汽车美容中心,15118160291,深圳,龙华区大浪街街道龙胜社区新区大道东侧潜龙曼海宁花园(北区)4栋138-140号,09:00-19:00,
车百汇汽车服务中心,18576696679,深圳,龙岗区布吉西环路65号（元平学校后门对面）,09:00-18:00,
金色都汇汽车美容,13925212229,深圳,罗湖区南湖街道春风路2040号,08:30-18:30,
惠新（汽车服务中心）,17503031983,深圳,罗湖区东门中兴路144号（黎明大院）,09:00-19:00,
强顺汽车之家生活馆,075588218008,深圳,南山区金世纪路4号,09:00-18:00,
壳牌（新泰诚汽车服）,13728834588,深圳,龙华区工业东路上油松村64栋,08:00-18:00,
CAREUD凯佑,15361636982,深圳,龙华区民治街道工业东路73号,09:00-18:00,
鸿大汽车维修服务中心（南山店）,13632601332,深圳,南山区月亮湾大道阳光棕榈园三期32栋4号商铺,08:00-19:00,
朝花汽车服务,18680301992,深圳,罗湖区文锦中路1013号,09:00-18:00,
优养一号,13823517680,深圳,龙华区民治街道人民路与工业路交汇处博园大厦123号,09:00-18:00,
米其林（锦星汽车美容服务中心）,13502893428,深圳,罗湖区春风路1005号,07:20-21:30,
金富力（鑫乐途汽车服务中心）,13427998622,深圳,龙岗区翠枫豪园对面华龙路33号,08:30-20:30,
雄得汽车维修行,13632552226,深圳,南山区三区购物中心105号,06:00-18:00,
宝城汽修,13534091443,深圳,龙华区龙华街道工业西路52号1楼,08:00-19:00,
宝鑫汽车服务中心（东联店）,0755-27847953,深圳,宝安区创业二路东联大厦1栋（平安银行右侧）,09:00-18:00,
百事达汽车服务有限公司,0755-33811830,深圳,南山区38区翻身路与龙泉一路交界44号,08:00-20:00,
启驾汽车服务有限公司,18667116035,深圳,龙华区梅龙大道996号共和综合楼3栋一楼,09:00-18:00,
顺旺汽车汽修(大浪店),13530765068,深圳,龙华区大浪街道龙胜社区龙胜8号厂房101号,08:00-19:00,
车仆（鑫坂龙车友会）,13715277859,深圳,龙岗区龙华街道富康社区东环二路69号慧华园厂房2栋101-106号,08:00-18:00,
丰达（车管家）,13691880833,深圳,龙岗区坂田街道办中海日辉台花园1栋120号-122号,08:30-19:30,
美孚（恒利达汽车维修中心）,13502833505,深圳,宝安区新安街道上合社区33区上川路 ,08:30-19:00,
好再来双重蜡水洗车,15718423837,深圳,罗湖区怡景花园1号10户,09:00-18:00,
大师修车（龙华店）,18123609492,深圳,龙华区龙华街道工业西第三工业区六号楼1层,09:00-18:00,
尊一汽车（深圳悦宝宝安分店）,18666669190,深圳,宝安区大宝路西一巷2号,09:00-18:30,
典典养车（快车手店）,15816869250,深圳,宝安区新安裕安二路220-1号,09:00-18:00,
固特异（宝兴顺汽车服务中心）,13923788898,深圳,宝安区二十七区裕安二路226-228号（锦华宾馆旁）,08:00-18:30,
德成名车汇美容维修服务中心,16620788820,深圳,龙岗区坂田街道居里夫人大道新天下工业区888号,08:30-18:00,
嘉远发汽车服务有限公司,18814222020,深圳,龙华区大浪街道高峰社区羊龙新村31号,08:00-18:00,
锐斯名车东盛营业部,13825202334,深圳,罗湖区东晓街道东盛路30号,08:30-19:00,
华兴汽车维护德盛行,13360089668,深圳,罗湖区金稻田路1089号36号-37号,09:00-21:00,
华龙辉汽配维修有限公司,15013861525,深圳,罗湖区金稻田路1089号,06:00-18:00,
车公爵汽车美容养护中心,17318013896,深圳,南山区松白路1021号,08:30-19:00,
车仆(龙盛达汽车),13670183637,深圳,龙华区早禾路6号,09:00-18:00,
华之龙汽车美容服务,14774722462,深圳,龙岗区布吉街道华龙新村143号,08:00-20:00,
深圳市车永佳汽车修理厂,15999646373,深圳,罗湖区东昌路48号东兴大厦1栋1层,09:00-18:00,
嘉实多（顺捷汽车养护中心）,0755-29050603,深圳,龙华区龙华街道东二环路南侧新华苑二期1号楼115-116号,09:00-18:00,
新永通汽车服务有限公司,13537557837,深圳,罗湖区东晓路3041号,07:30-18:30,
车鲁班汽车一站式服务会馆,13751139481,深圳,龙华区大浪街道高峰社区云峰路21号,08:30-20:30,
东乐花园洗车场,13556820017,深圳,罗湖区深房东乐花园布心路1023号,08:00-19:00,
宝坤达汽车服务中心,13322991138,深圳,龙岗区吉政路与广场路交叉口向东50米,09:00-18:00,
大师修车（布吉店）,18126208287,深圳,龙岗区布吉街道吉政路54号中腾胜科技园B栋105号,09:00-18:00,
唐车荟汽车名车维修,15999611114,深圳,龙岗区广场路58号,09:00-18:00,
明燕汽车服务中心,13723457345,深圳,龙岗区布吉街道可园社区南区吉利厂房102号,09:00-18:00,
翔翼汽车维修美容,13414473645,深圳,龙岗区坂田街道岗头社区马蹄山居里夫人大道168号,08:00-21:00,
壳牌(亿仕达汽车维修中心）,13510225230,深圳,龙华区大浪街道华荣路80号,08:00-19:00,
益车社汽车服务,18682099255,深圳,龙华区大浪街道高峰社区三合路1号,08:00-20:30,
星容行汽车服务,13528810029,深圳,龙岗区布吉半岛苑103号（银龙加油站旁）,09:00-18:00,
邓禄普轮胎（城市明珠店）,18565848823,深圳,龙华区龙华区龙观路315号（大元明珠幼儿园）,09:00-19:00,
名驹汽车服务中心,13798366369,深圳,宝安区怡园路74区公园7栋5171号,08:00-19:00,
佳通轮胎(骏达汽车服务中心),13530911384,深圳,龙华区龙观快速路8号,09:00-18:00,
车友嘉汽车服务,18823833685,深圳,龙华区大浪街道三合华侨新村A2区1栋一楼,09:00-18:00,
深圳市柏龙汽车销售有限公司,13662230841,深圳,龙华区龙华新区龙华街道和平路段31号,09:00-18:00,
车士邦汽车服务中心,18822851695,深圳,龙岗区布吉景芬路 龙园意景华府36栋商铺101-105号,09:00-19:00,
狮魔（华联汽车维修中心）,13537649437,深圳,宝安区76区流塘路华联大厦209号,09:00-18:00,
车之恋汽车养护,18948756906,深圳,龙华区清湖路82号1楼,08:30-19:00,
桦楠汽车美容俱乐部,13088888850,深圳,南山区应人石社区同康富工业园综合一楼,08:00-20:00,
大师修车（西乡店）,13302906363,深圳,宝安区五十区宝安大道开屏路1-3号,09:00-18:00,
鑫鹏浩迈卡车友会服务中心,13713922662,深圳,宝安区西乡六塘路中粮锦云103-104商铺,08:00-17:30,
车福汽车服务,18825225550,深圳,宝安区前进二路中粮锦云花园1栋C座113-115号,08:20-19:00,
鑫东旺湖汽车美容维修中心,13590169015,深圳,龙华区龙华新区和平东路9号（清湖路段）,06:00-18:00,
安记汽车服务,13424222880,深圳,宝安区西乡街道庄边路金庄园商务楼1楼75号,09:00-18:00,
嘉实多（艺通汽车服务）,13826551911,深圳,龙华区东环一路世贸广场31号,08:00-20:00,
潮汇汽车养护,13725539110,深圳,宝安区石岩街道径贝村添好工业区B栋12号,08:00-18:30,
粤通行汽车服务有限公司,075561563222,深圳,龙华区大浪街道浪口社区华悦路6栋111号,08:00-19:00,
比比卡汽车养护连锁机构（大浪店）,13691814890,深圳,龙华区大浪街道华悦路150号,09:00-18:00,
车部落汽车养护中心,18211420381,深圳,龙华区祥利路8-10号,09:00-18:00,
倍耐力（转轮王汽车胎铃）,13510117911,深圳,宝安区西乡街道柳竹社区宝安大道华侨新村2B栋宝安大道3025-1号,09:00-19:00,
美孚(新华旺汽车美容养护站),13725541018,深圳,龙华区华昌路217号,09:00-18:00,
荣泽汽车养护中心(大浪店),13058151841,深圳,龙华区大浪街道华盛路9区1号楼,08:30-19:00,
神盾养车（龙富店）,18823853900,深圳,龙岗区龙富路37号,08:30-19:00,
美孚(名车汽车养护),15814049779,深圳,龙华区大浪街道华兴路78号,08:00-21:00,
深德爱车美容,13923779607,深圳,龙华区大浪街道浪口社区浪口工业园82号,08:30-20:30,
缤纷车生活,15889298675,深圳,龙岗区甘李二路3号中海信创业产业园17b幢地下2层车库入口,08:20-19:00,
众宇汽车维修服务站,18676663028,深圳,龙华区大浪街道华昌路268号众宇汽车,08:30-19:00,
私家车友会（西乡店）,13543288192,深圳,宝安区宝安大道宝乐新村6巷9号,08:00-18:00,
比优卡（西乡志晖店）,18938830760,深圳,宝安区西乡前进二路112号,08:00-18:00,
隆盛汽车维修服务中心,18666290106,深圳,龙华区枭龙路5号（枭龙路与大浪工业园路交叉口附近）,09:00-18:00,
鹏城汽修行,13691758003,深圳,龙华区大浪街道同胜工业园路浦华科技园B103号,09:00-18:00,
MOS膜师,13590117093,深圳,宝安区宝安大道碧海名园东门向东50米,08:35-19:00,
壹伍陆连锁汽车服务,18923743293,深圳,宝安区西乡街道共和工业路27号1楼,08:00-20:00,
CCH敞车汇,15986828110,深圳,龙华区石岩街道恒安和加油站向东50米,08:45-19:00,
德源汽车养护,13723711395,深圳,宝安区西乡碧海名园60-61商铺,09:00-18:00,
一发汽车美容服务中心,18681518868,深圳,龙华区龙华新区观湖街道上坑社区澜园路7号好品居高新科技园旁,10:00-20:00,
摩马车奶爸（观澜店）,18165763839,深圳,龙华区大和路84号,09:00-19:30,
比比卡汽车养护连锁机构（兴振鹏店）,13632290734,深圳,龙华区观澜管环观南路124号,08:00-18:00,
新陆标汽车维修服务中心,18823752639,深圳,龙华区石岩街道水田社区宝石东路92号,09:00-18:00,
新金大汽车维修,13760129634,深圳,宝安区西乡银田工业区C3栋1楼,09:00-18:00,
炫车汇汽车服务有限公司,13480265875,深圳,宝安区石岩吉祥路14号,09:00-18:00,
昆仑天润(兴华通汽车维修中心),13691864393,深圳,龙华区石岩街道石龙仔道11号,08:00-08:00,
壳牌（南湾汽车之家）,075584529323,深圳,龙岗区红棉路66号,08:00-20:00,
粤车汇服务有限公司,13113021914,深圳,宝安区西乡银田工业区35栋5号,08:00-18:00,
劲业兴汽车维修服务中心,13684966886,深圳,宝安区石岩开明街13号,08:00-18:00,
卡莱斯汽车服务有限公司,13751022290,深圳,宝安区石岩街道青年路33号,08:00-18:30,
主流汽车护理,18988797273,深圳,宝安区石岩街道浪心青年路38号,08:00-19:00,
美孚（车之缘汽车服务中心）,13600159429,深圳,宝安区石岩街道浪心社区洲石路1号石岩物流园E栋1号,08:00-19:00,
美孚(艺车会汽车服务桃源居店),075527811132,深圳,宝安区西乡镇前进二路（华盛辉.智慧创新中心左侧）,09:00-18:00,
车仆(佳友汽车服务中心),18925283646,深圳,龙华区石岩街道水田石龙仔五区33号,09:00-18:00,
美孚(艺车会汽车服务宝车丽店),075527086089,深圳,宝安区西乡街道广深路450号,09:00-18:00,
兴亮平汽配维修,13751018396,深圳,龙岗区平湖镇新木村新木路111号,08:00-18:00,
捷富星汽车服务,15118161384,深圳,龙华区观澜街道大和路141号,08:30-20:00,
澳巍汽车服务中心,13715389652,深圳,龙岗区平湖华南城5号馆（地下停车场F区）,06:00-18:00,
首道汽车服务中心,18598244411,深圳,宝安区石岩街道龙腾社区宝石西路39号,08:00-20:00,
好运汽车美容维修,15999523672,深圳,宝安区石岩宝石西路138号,09:00-18:00,
易养车,13316460299,深圳,宝安区北二路深业U中心地下停车场负2层,09:00-18:00,
金锋汽车服务,15919802530,深圳,宝安区西乡固戍宝源路与碧湾路交汇碧湾大厦1楼,08:30-18:30,
喜车道,13410333884,深圳,龙岗区平湖镇平吉大道北303号,08:00-21:00,
私家车友会一站式汽车服务（固戍店）,13682636663,深圳,宝安区西乡街道固戍花园45号,09:00-18:00,
新丽峰汽车维修服务部,15813887483,深圳,龙华区观澜街道观城社区大和路316号,08:30-20:00,
洗车人家（固戍店）,19928844100,深圳,宝安区西乡街道固戍社区香格丽湾园2-112号,08:00-21:00,
富年汽车维修,18118726683,深圳,宝安区石岩北环路184号,08:00-18:00,
爱车有道汽车维修服务,15013883636,深圳,龙岗区观澜街道新田社区新樟路70号,08:00-20:00,
车仆（长圳店）,13713761280,深圳,宝安区玉堂街道长圳社区长圳路106号,08:00-18:00,
胎铃世界汽车服务,15813745925,深圳,宝安区石岩街道松柏路2499号,08:00-19:00,
马牌（鸿基汽车美容）,15012969294,深圳,龙岗区宝龙街道同富路36号,08:00-19:30,
车仆（车工场汽车养护中心）,13543257879,深圳,龙岗区平湖街道平安大道309号停车场入口,09:00-20:00,
速8汽修,13510208633,深圳,龙华区观澜福前路40号,09:00-18:00,
车爵仕（振业城店）,15813711388,深圳,龙岗区横岗街道深峰路109-111号,08:00-19:30,
车饰界（汽车维修美容养护中心）,15899893676,深圳,龙岗区平湖平龙西路296号,09:00-19:00,
凯兴达汽车维修美容,13825249975,深圳,龙华区观澜福前路80号,09:00-18:00,
博车汇汽车服务中心,13510339656,深圳,龙华区观澜碧澜路59号,08:10-18:00,
华南城汽车服务,13410142523,深圳,龙岗区平湖街道平新北路253号,08:00-21:00,
鑫森汽配,13537564238,深圳,宝安区石岩街道爱群路同富裕工业区101号,08:00-18:00,
美车屋汽车美容,18588733784,深圳,龙岗区富安街100号,09:00-19:00,
比比卡汽车养护连锁机构（国民店）,075529807682,深圳,龙华区福前路123-3号,08:00-20:30,
深圳市大林汽车美容维修中心,13728798538,深圳,宝安区石岩北环路156号,08:00-23:00,
深亚美汽修厂,0755-27692708,深圳,宝安区宝安大道水产三围工业园A栋1层3号,09:00-18:00,
嘉实多（新塘城）,13760192629,深圳,龙华区福前路99号,08:00-19:30,
车饰界汽车维修服务中心,13530052535,深圳,龙华区龙华新区观澜观平路291号,08:28-19:00,
美孚（瑞翼汽车服务中心）,18923834148,深圳,龙岗区平湖街道禾花社区振业路7-17号(原金丽华KTV大楼),09:00-19:00,
恒海汽车维修中心,13332959891,深圳,龙华区龙华新区观澜观街道新田社区牛轭岭村252,08:00-20:00,
美孚（捷立汽车清洁养护中心）,13622356175,深圳,龙岗区横岗振业城5-8栋101号商铺,08:00-18:30,
嘉实多（平通顺汽车维修）,13510202481,深圳,宝安区西乡街道南昌路上合工业园B厂房2栋1楼,09:00-18:00,
世鸿汽车维修中心,18818533783,深圳,龙华区观澜街道大布巷布新路138号,08:00-20:00,
优动力汽车服务,15112550246,深圳,龙岗区平湖大街271号,09:00-20:30,
车之魂汽车之家,18929320498,深圳,龙华区观澜泗黎路189号,09:00-18:00,
嘉立汽车美容中心,13510654534,深圳,龙华区观澜街道桂花路101号,08:30-19:30,
车饰界养车,15994811152,深圳,龙华区观澜大水坑村大塘路404号,09:00-18:00,
华汽汽车美容养护中心,13714893303,深圳,龙华区观澜大水坑一村大水坑路90号,08:30-19:00,
龙祥腾汽车服务有限公司,13823242131,深圳,龙岗区六和路6号,08:30-19:00,
鑫乐汽车服务中心,17722816862,深圳,龙岗区横岭路忠太行手袋厂旁17号,08:30-20:30,
车元胜汽车美容维修中心,13603052923,深圳,龙岗区深惠路588号,09:00-18:00,
新车王子,075585218899,深圳,龙岗区腾昌二路14号,08:00-18:00,
一新汽车美容基地,15986805758,深圳,龙岗区塘坑路48号,08:00-19:00,
壳牌（御轮名车一站式服务）,13828733058,深圳,盐田区沙头角深盐路商住楼E栋,08:00-18:00,
永春洗车,17875468443,深圳,宝安区金稻田路1111-8号,08:00-19:00,
大师修车（横岗店）,18924608148,深圳,龙岗区横岗街道龙岗大道3300号,09:00-18:00,
马瑞利捷驶星车港湾总店,13882893644,深圳,龙岗区横岗街道华西二路1号鼎盛创意园105室,08:30-19:30,
粤海快修美容店,15919983618,深圳,盐田区沙井头西街27号一层6-7号,06:00-18:00,
壳牌（车爵士美车会塘坑店）,13728999832,深圳,龙岗区龙岗大道横岗段4036号,08:00-19:00,
问心汽车人服务中心,075522740287,深圳,盐田区沙盐路盐田汽车站大楼B层101,09:00-18:00,
卡邦龙汽车服务中心,13544183269,深圳,光明区光明新区玉塘街道玉律社区五区一巷53号,08:30-17:00,
顺通车汇汽车服务,13798500600,深圳,龙华区福城街道章阁章阁路343号,08:30-19:00,
众诚汇汽车服务中心,13798447889,深圳,龙岗区安业路6-1号,08:30-18:00,
振兴鑫汽车维修美容服务中心,13724319465,深圳,光明区田寮村高强街6号,08:00-19:00,
盛丰行汽车服务中心,13713901578,深圳,龙岗区龙岗大道5198号,09:00-18:00,
华飞汽车服务有限公司,18702320226,深圳,龙岗区横岗镇园山街道安兴路44号,08:00-19:30,
爱德龙（佳豪汽车服务中心）,075528262809,深圳,龙岗区大康路19号,08:30-18:00,
卡诺嘉汽车美护服务中心,17620383880,深圳,龙华区观澜街道黎光社区黎光新工业区119号,08:30-20:30,
車仆(鸿盛汽车养护中心),13510113667,深圳,光明区松白公路88号,09:00-18:00,
治诚健汽修美容服务部,13510787365,深圳,龙岗区横岗镇园山街道沙荷路35号,08:30-21:00,
福林顺汽车服务中心,13510669676,深圳,宝安区福永大道白石厦东区淇誉路2号,08:00-18:00,
新鑫龙兴汽车生活馆,18938695015,深圳,龙华区华盛路62号,09:00-18:00,
超顺达名车维修中心,13723746879,深圳,光明区公明街道田湾路128号,08:30-19:30,
尚车芸汽车服务中心,18128855487,深圳,光明区田湾路125-129号,08:30-19:00,
众志汽车服务有限公司,13786679037,深圳,光明区甲子塘大道鸿晟科技园A区A号,08:30-18:30,
名爵仕汽车专业维修美容服务中心,18682190865,深圳,光明区河心南路45号,08:00-20:30,
邓禄普（路德士汽修厂）,13927417881,深圳,龙岗区横岗横坪公路7-1号,08:00-19:00,
城益汽车维修美容中心,13751010031,深圳,宝安区凤凰大道140号,08:00-19:00,
壹特车体养护,13554881148,深圳,龙岗区荷坳水晶时代公寓商铺105号,09:30-19:30,
车仆（鸿伟汽车服务中心）,13689582963,深圳,宝安区新桥街道新二庄村路43号,08:00-18:00,
美捷汽车美容中心,13538252679,深圳,光明区高墩北路198号,09:00-18:00,
加美润滑油（车聚豪汽车维修）,13714445704,深圳,宝安区南浦路50号,09:00-19:00,
姿态汽车美容中心,13728483493,深圳,光明区工业区大道26号,08:30-18:30,
新创力汽车服务,18924588158,深圳,龙岗区横岗街道荷坳社区长江埔路70-1号A栋103,08:30-19:00,
盛龙汽车服务,075529751168,深圳,光明区光明新区光明加油站到后长园基地,09:00-18:00,
腾龙汽车美容,13632885335,深圳,光明区蒋石路149号,08:30-18:00,
卓翔汽车服务中心,13760133125,深圳,宝安区新桥街道新玉路港湾公寓A栋124-125号铺,09:00-18:00,
车仕界汽车服务中心,13632774187,深圳,光明区公明镇大围路秋园雅苑26号,08:30-19:30,
光明区爱车居汽车连锁服务,13713635860,深圳,光明区马田街道新庄社区大围路口2排,08:00-21:00,
大师修车（沙井南环店）,13316982740,深圳,宝安区沙井街道办南环路万丰第三工业区2栋101-1号,08:00-17:30,
鑫瑞胜汽车维修,18676722825,深圳,宝安区福海街道桥头村重庆路3号,08:30-20:00,
爱车之宝汽车维修美容服务中心,13164722885,深圳,光明区马田街道石围社区石围新村10栋D单元101号,09:00-18:00,
车仆（宝典汽车服务有限公司）,13544110858,深圳,光明区新围路50号,08:00-20:00,
锦兴汽车维修美容,13544153219,深圳,宝安区福永塘尾荔园路5-4号,09:00-18:00,
众兴汽车维修中心,13510196819,深圳,宝安区福永街道桥头重庆路25一1,08:30-18:30,
美的爱车之家汽车服务中心,18218650861,深圳,宝安区荔园路9号,08:00-19:00,
嘉实多（洁车坊汽车服务）,13530664277,深圳,龙岗区如意路130号,09:00-18:00,
统一润滑油(深荣威汽车服务中心),15112557535,深圳,宝安区凤塘大道519号,09:00-18:00,
可可车汽车服务中心,13537622214,深圳,龙岗区龙城街道爱联社区军田路12号101,09:00-18:00,
诚铭汽车服务中心,18711217747,深圳,宝安区万里路3号,08:02-20:00,
金吉星(鑫鑫隆汽车维修),17376814041,深圳,宝安区福永街道塘尾社区一巷21号,09:00-18:00,
车仆（添翼汽车服务）,13435222702,深圳,宝安区沙井街道南环路228号,08:10-18:30,
车友来连锁汽车服务,13528788306,深圳,龙岗区爱联如意南路26号,08:30-19:30,
车君道汽车维修服务有限公司,18926068695,深圳,宝安区万安路41号,09:00-18:00,
美孚（熙盛威店）,18318676244,深圳,宝安区和沙路47-5,08:30-19:30,
洗德好有限公司,13422885282,深圳,龙岗区龙城街道黄阁路182号,09:00-18:00,
江扳手车业连锁机构,13410332566,深圳,宝安区万安路131号,09:00-18:00,
诚众汽车服务中心,15218186925,深圳,宝安区松岗街道潭头社区商住二区43-1号,08:30-19:00,
统一润滑油（兴隆汽修美容服务）,13530529958,深圳,宝安区蚌岗路98号,09:00-19:00,
宝明杰汽车服务（龙翔店）,13823553582 ,深圳,龙岗区中心城龙翔大道6099号（国安居后面）,08:00-18:30,
壳牌（恒昌汽车维修厂）,18923812682,深圳,宝安区永福路260-5号,07:00-20:00,
新领域汽车服务中心,13425151500,深圳,光明区公明街道金辉路1-21号,09:00-18:00,
深圳市恒涛汽车美容护理中心,13418979496,深圳,宝安区沙井街道岗厦路21-23号,09:00-18:00,
车仆（靓车堡汽车服务）,13510620686,深圳,宝安区沙井街道大王山工业2路,09:00-18:00,
卡思壹号,13590153587,深圳,龙岗区宝沙一路金地名峰6幢A059-A061号,09:00-19:30,
