辉旺汽车快修服务中心,13560752923,深圳,光明区公明街道民生大道52号,09:00-18:00,
车仆（博驰汽车服务中心）,17722639975,深圳,宝安区沙井街道沙壆三路66号,08:30-18:00,
福睿德汽车会馆,13428788225,深圳,龙岗区龙岗中心城吉祥南路18号,09:00-19:00,
名源服务有限公司,13539474382,深圳,龙岗区龙腾二路1-2号,08:00-19:00,
德国卫斯理专业汽车美容养护,13922760256,深圳,宝安区沙壆三路1号 ,08:00-19:00,
永吉利汽车美容店,15118037388,深圳,宝安区松岗街道潭头社区东辅路8号,09:00-18:00,
大师修车（龙岗店）,18138442553,深圳,龙岗区南联社区宝南路17号,09:00-18:00,
美孚（新宏汽车维修服务中心）,18100283960,深圳,光明区公明街道松白路5035号1楼,09:00-18:00,
宝靓辉汽车服务有限公司,13670047303,深圳,宝安区裕民路103号,08:00-19:00,
典典养车(俊宝汽车服务),15014066156,深圳,光明区松岗街道楼岗社区楼岗大道46号前进公社一期二栋9号,08:00-19:00,
路威斯润滑油（武天辉汽修）,18676761194,深圳,宝安区沙井街道和二村和二2路,08:00-18:30,
车之宝汽车美容维修,13662636037,深圳,宝安区立业路26号,09:00-18:00,
森之达汽车服务,13510778168,深圳,宝安区松岗街道红星社区温屋西路99号,08:00-20:00,
铭轩微修（友车辉汽车维修美容）,13686448136,深圳,光明区振明路213-1号,08:00-18:30,
必优卡汽车服务权兴店,15016299782,深圳,宝安区松岗街道东方上报美丽嫦工业区三幢一楼,09:00-18:00,
喜车荟汽车服务中心,075523757501,深圳,宝安区沙井西环路6号,09:00-18:00,
俊宝养车汽车服务中心,15112298425,深圳,光明区松岗社区松岗车站一街4号,08:30-18:00,
新光汽车美容护理中心,13714196676,深圳,宝安区松盛大夏1层,09:00-18:00,
博洋汽车美容中心,18666822936,深圳,龙岗区向银路26号,08:00-20:00,
车仆（鑫屹峰汽修服务）,18925276537,深圳,光明区泥围新村1号,08:00-19:00,
昱兴业汽车服务有限公司,13603051156,深圳,宝安区松福大道2111号,09:00-18:00,
英莱壳润滑油（义生宝汽车服务中心）,13984590708,深圳,龙岗区龙岗街道南联社区爱南路243号,08:30-20:00,
车仆（福发汽修）,075581766587,深圳,宝安区沙井后亭福发科技园商铺21-26号,09:00-18:00,
车汇诚汽车服务有限公司,13410456206,深圳,宝安区沙井街道沙二新村三巷8号,08:00-20:00,
道达尔（恒通汽车服务中心）,13760340734,深圳,宝安区宝安区中亭东路2-4号,09:00-18:00,
艾克斯汽车服务中心,13432784246,深圳,宝安区松岗街道松岗社区麒麟新村六巷七号一楼,08:00-19:00,
车仆（优众汽车维修）,13040848545,深圳,龙岗区龙岗中心城邱屋街63号,09:00-21:00,
车厘籽,13163791401,深圳,坪山区碧岭街道碧岭社区水新路31号,08:30-19:00,
波士卡尔（龙岗店）,13392811171,深圳,龙岗区南联刘屋村路109号,08:30-20:00,
永安泰汽车服务,19925152968,深圳,龙岗区回龙路4号,08:00-20:00,
360°汽车服务,15989362650,深圳,宝安区松福大道海欣花园西侧门8号,09:00-18:00,
嘉实多（新兴利汽车维修部）,13715277624,深圳,龙岗区南联龙河路136号1层,08:30-19:00,
养车年华,13802580083,深圳,龙岗区龙岗街道爱南路146号,08:30-19:00,
宝明杰汽车服务（南联店）,13823553582,深圳,龙岗区南联怡丰路3号,08:00-19:00,
洗得净汽车维修美容中心（沙井店）,13418985815,深圳,宝安区沙井街道园和路共和小区共和花园裙楼12-13楼1-2门面,06:00-18:00,
盛丰汽车养护中心,18928436861,深圳,龙岗区龙岗街道南联社区彭达路21-1号,09:00-18:00,
车仆(东伦汽车服务),17503037438,深圳,宝安区松岗街道沙朗路58号,08:00-19:00,
燕罗鑫仁房汽车养护中心,13427949318,深圳,宝安区公明象山大道仁房汽车服务,08:00-21:00,
广利名车维修,13926563252,深圳,龙岗区新生路309号,09:00-18:00,
鹏宇名车维修,13682492064,深圳,龙岗区龙岗街道南联社区颐景峰苑商铺106号,09:00-18:00,
尚捷汽车美容中心,13500045553,深圳,龙岗区宝龙街道龙东社区金井路86号101号,08:00-19:30,
壹号车专业汽车美容店,13714143639,深圳,龙岗区宝龙街道同昌路46号,09:00-18:00,
比比卡汽车养护连锁机构（广田店）,13510891582,深圳,宝安区松岗街道塘下涌广田路163-165号,09:00-18:00,
深辉荣汽车维修中心,15915348714,深圳,龙岗区龙东社区爱南路13号101铺,08:00-21:00,
有家汽車生活館,15919999849,深圳,龙岗区新城路深房传麒尚林41号,09:00-18:30,
同乐骏达汽车美容服务中心,18565649495,深圳,龙岗区同乐社区岗德路63号,09:00-18:00,
众鑫奇护,17671654111,深圳,龙岗区宝龙街道同心路47号,08:00-21:00,
深圳汇宝强汽车维修服务有限公司,15875538792,深圳,龙岗区龙岗街道同乐社区岗德路99-2号,09:00-18:00,
永和汽车美容中心,15915373373,深圳,坪山区金碧路70号,08:00-18:30,
固特异（风驰天下汽车服务有限公司）,18675579396,深圳,坪山区坪山新区坪山街道六和社区宝山第四工业区5栋1楼,08:30-21:00,
壳牌（吉兴汽车维修服务行）,18923727315,深圳,坪山区体育三路32-5号,08:30-21:00,
飞东汽车服务,075528824028,深圳,坪山区新和路32号,08:30-18:30,
加德士润滑油（敬业汽车服务有限公司）,18938666769,深圳,坪山区坪葵路227号,08:00-19:00,
海航汽车美容服务中心,13076919826,深圳,龙岗区葵涌镇华强路43号,08:00-19:00,
鑫达成汽车服务中心,13922844864,深圳,宝安区松岗街道潭头社区旧一村曹登二栋102,08:00-20:00,
